description,name,entityUrl,price
Linksys EtherFast 8-Port 10/100 Switch (New/Workgroup),Linksys EtherFast EZXS88W Ethernet Switch - EZXS88W,10011646,
5 x 10/100Base-TX LAN,Linksys EtherFast EZXS55W Ethernet Switch,10140760,
NETGEAR FS105 Prosafe 5 Port 10/100 Desktop Switch,Netgear ProSafe FS105 Ethernet Switch - FS105NA,10221960,
1 x HD-15 - 1 x HD-15 - 10ft - Beige,Belkin Pro Series High Integrity VGA/SVGA Monitor Extension Cable - F3H982-10,10246269,
Netgear ProSafe 16 Port 10/100 Rackmount Switch- JFS516NA,Netgear ProSafe JFS516 Ethernet Switch,10315184,
LaCie Pocket USB Floppy 1.44 MB,LaCie Pocket Floppy Disk Drive - 706018,10316920,
36 Page 4' x 6',Canon KP 36IP Print Cartridge / Paper Kit - 7737A001,10326220,9.99
Optical - USB PS/2,Kensington Orbit Optical Trackball - USB w/PS2 Adapter - 64327,10333368,
16 x 10/100Base-TX LAN,Linksys EtherFast EF4116 Ethernet Switch,10333846,
24 x 10/100Base-TX LAN,Linksys EtherFast EF4124 Ethernet Switch,10333848,64.99
Linksys EG005W Gigabit 5-Port Workgroup Switch,Linksys Instant Gigabit EG005W Ethernet Switch,10343605,
54Mbps - 1 x 10/100Base-TX,Linksys G Wireless-G WET54G Wireless Bridge,10346525,
Input Voltage:12V DC - Output Voltage:120V AC - 375W Pulse-width Modulated Sine Wave,Tripp Lite PowerVerter 375-Watt Ultra-Compact Inverter - PV375,10351869,
NETGEAR ProSafe 5 Port Gigabit Desktop Switch,Netgear ProSafe GS105 Ethernet Switch - GS105NA,10353206,
1 x HD-15 - 1 x HD-15 - 25ft - Black,Belkin Monitor Cable - F3H982-25,10360978,15.98
,Logitech Driving Force Pro for PlayStation 2 - 963293-0403,10363070,
Input Voltage:12V DC - Output Voltage:110V AC - 300W Stepped Sine Wave,Belkin AC Anywhere 300W Power Inverter - F5C400-300W,10363243,
54Mbps,Linksys Wireless-G Range Expander Wireless Bridge - WRE54G,10365096,
VAIO NEOPRENE NOTEBOOK & AC ADAPTER CASE UP TO 17 IN LCD,Sony VAIO Notebook and AC Adapter Case - VGPAMC2,10373002,
D-Link Broadband Cable Modem,D-Link Express EtherNetwork High-Speed DOCSIS 2.0 Cable Modem - DCM-202,10376165,
Clam Shell - Neoprene,Sony Notebook and AC Adapter Cases - VGPAMC3,10377226,12.99
Panasonic Toner Cartridge for the KX-FL511 KX-FL541 KX-FL611 and KX-FLM651 Series,Panasonic Black Toner Cartridge - KX-FA83,10379358,
2.1-channel,Logitech Z-2300 Multimedia Speaker System - 970118-0403,10380060,
Sony DVM-63 HD High-Definition miniDV Videocassette,Sony High Definition Mini DV Cassette - DSL-190-B,10382243,
NETGEAR Prosafe 802.11g Wireless Access Point,Netgear ProSafe WG102 Wireless Access Point 802.11g - WG102NA,10388980,
108Mbps,Netgear RangeMax WPN802 Wireless Access Point - WPN802NA,10412590,
24 x 10/100Base-TX LAN 2 x 10/100/1000Base-T,Netgear ProSafe FS726TP 24 Port 10/100 Smart Switch - FS726TPNA,10412788,
,PlayStation 2 Memory Card 8MB,50009858,
,SONY 7-11719-70670-0 PS2 8 MB Memory Card 2-pk - 97067,50012447,
,PlayStation 2 DUALSHOCK Analog Controller - Green,50012453,
,PlayStation 2 DVD Remote - 97076,50017228,
Nickel-Metal Hydride (NiMH) - 2.4V DC - Headset Battery,Sennheiser Nickel metal hydride Battery for Headsets - BA-151,90049752,14.34
Head Cleaner,Sony MiniDV Head Cleaner - DVM12CLD,90049795,7.95
VCR Camcorder AV Receiver Video Game Console TV Laser Disc Player DVD Player Compatible - 4 x S-Video In 4 x Composite Video In 4 x Stereo Audio Line In 1 x S-Video Out 1 x Composite Video Out 1 x Stereo A,Sony SB-V40S A/V Selector - SBV40S,90049928,
1 x Phone Line(s) - White,Panasonic KX-TS108W Corded Phone,90104307,
2 x Phone Line(s) - Headset - White,Panasonic KX-TS208W Corded Phone,90105056,
Top Loading - Handle - Nylon - Black,Garmin Canvas Deluxe Carry Case - 010-10231-01,90105156,17.45
- Blue,Sony h.ear Stereo Earphones - MDRJ10/BLUE,90105458,12.38
,BELKIN PRO SERIES USB DEVICE CABLE 16 - F3U133-16,90105654,12.21
Stainless Steel - 20 lb,OmniMount Universal Wall Speaker Mounting Kit - 20.0 WALL-B,90106172,24.34
Stainless Steel - 20 lb,OmniMount Stainless Steel Speaker Mount - 20.0 WALL-W,90106210,
Steel - Silver,Sanus Euro Foundation Series III Speaker Stand - EFSATSIII,90108521,
,Peerless Adjustable TV Wall Mount - PM1327,90109367,
Steel - Black,Sanus Euro Foundation Series III Speaker Stand - EFSATBKIII,90111702,
Over-the-head,Panasonic KX-TCA86 Headset,90114398,11.03
Floor Standing Tripod - 21.62' to 56.75' Height - 6.61 lb Load Capacity - Black,Sony VCT-R640 Tripod - VCTR640,90114631,
Steel - 50 lb,Sanus Flat Panel TV Wall Mount - VMF,90120953,
Plastic - 8 lb,Sanus Speaker Mount - WMS3B BLACK,90125772,
Plastic - 8 lb,Sanus Wall/Ceiling Speaker Mount - WMS3S SILVER,90125786,
1.4GB - 3 Pack,Sony Mini DVD-R Media - 3DMR30L1H,90128026,6.99
2 x Phone Line(s) - Headset - Black,Panasonic KX-TS3282B Corded Phone,90128649,
,Sennheiser RS 120 Wireless Hi-fi Headphone - RS120,90131741,
Steel - 130 lb,Sanus Flat Panel TV Wall Mount - VMPL50-B,90131941,
,Sony PS-LX350H Belt-Drive Turntable,90132241,
,Sony STR-DE197 - AV Receiver - 100 Watts per Channel,90136420,122.43
150 lb,Sanus Television Turntable - TV/LCDS,90137168,
Over-the-head,Panasonic KX-TCA92 Headset,90138520,18.42
2 x Phone Line(s) - Headset - Black,Panasonic KX-TSC14B Corded Telephone,90138537,
,Sony CDP-CX355 300 Disc MegaStorage CD Changer,90138609,169.13
Aluminum - 50 lb,Sanus Flat Panel TV Wall Mount - VM1B,90139261,69.99
Lithium Ion (Li-Ion) - Photo Battery,Canon NB-2LH Battery Pack - 9612A001,90139585,
,Olympus B-90SU AA/AAA Size Battery Charger - 200899,90139860,
,Sony CDX-565MXRF 10-Disc CD/MP3 Changer,90140166,134.12
OmniMount CCH1B Set-Top Center-Channel Shelf,OmniMount TV Top Shelf Mount,90140203,21.49
Canon NB-4L Lithium Ion Battery,Canon NB-4L Rechargeable Camera Battery - 9763A001,90140498,36.89
Panasonic LM-AF120LU5 Rewritable DVD-RAM Disc without Cartridge,Panasonic 3x DVD-RAM Media,90141074,
for NB-4L,Canon CB-2LV Battery Charger - 9764A001,90141687,
Canon 9517A002 EF-S 17-85mm f4-5.6 IS USM Standard Zoom Lens with Optical Image Stabilizer,Canon EF-S 17-85MM f/4-5.6 IS USM Standard Zoom Lens,90142591,515
- Black Silver,Sennheiser RS 140 Wireless RF Headphone - RS-140,90144996,144.97
,Sennheiser RS 130 Wireless Headphone - RS130,90144998,144.95
Sony MDR-EX81LP/B Stereo Earphones - Black,Sony Fontopia Earbuds - MDREX81LPB,90145444,34.88
Steel - 280 lb,Sanus VisionMount Flat Panel TV Wall Mount - VMPL3B,90145560,144.05
Steel Aluminum - 80 lb,Sanus Flat Panel TV Wall Mount - VM400S,90145561,
15 lb,Sanus Under Cabinet LCD TV Mount - VMUC1S,90145568,
Steel Aluminum - 80 lb,Sanus Flat Panel TV Wall Mount - VM400B,90145584,
50 lb,Sanus Universal Projector Ceiling Mount - VMPR1B,90145586,
,Weber 848001 Performer 22.5' Charcoal Grill in Dark Blue,90145909,
,Weber 841001 Performer 22.5' Charcoal Grill in Black,90145972,
Plantronics Voyager510 Bluetooth Headset,Plantronics Voyager 510 Bluetooth Earset,90146847,
Steel - 30 lb,OmniMount TV Top Shelf Mount - CCH1P,90148258,
Sony LCS-CST Soft Carrying Case for Ultra-Compact Digital Cameras,Sony LCS Soft Carrying Case - LCSCST,90148541,9.95
,Linksys WRV54G Wireless-G VPN Broadband Router,200924629,
,Kingdom Hearts II,201647442,19.99
Magenta,Canon CLI-8M Ink Cartridge - 0622B002,201692648,10.35
Color,Canon Ink Cartridge For PIXMA iP1600 iP6210D and iP6220D Printers - 0617B002,201692660,19.11
Black,Canon Ink Cartridge For PIXMA iP4200 iP5200 iP5200R and iP6600D Printers - 0620B002,201692665,13.99
Cyan,Canon CLI-8C Ink Cartridge - 0621B002,201692677,13.99
Yellow,Canon CLI-8Y Ink Cartridge - 0623B002,201692679,13.99
Black,Canon Black Ink Cartridge - 0615B002,201692695,
Canon PGI-5 Pigment Black Ink Cartridge for Canon ContrastPLUS Photo Printers,Canon PGI-5BK Black Ink Cartridge - 0628B002,201692705,14.99
Peerless Flat Wall Mount for 23'- 46' LCD Screens - Black,Peerless Universal Flat Wall Mount - SF640P,201699873,
16 x 10/100Base-TX LAN,Netgear ProSafe FS116P Ethernet Switch - FS116PNA,201700823,
Peerless Smart Mount ST660P Universal Tilt Wall Mount for 37' to 60' Screens (Black) up to 200lbs,Peerless Universal Tilt Wall Mount,201701865,
Netgear ProSafe JGS544F - 24 Port Gigabit Rackmount Switch with 2 Gigabit Slots,Netgear ProSafe JGS524F 24-Port Gigabit Ethernet Switch - JGS524FNA,201744288,
1 x HD-15 - 1 x HD-15 - 25ft - Black,Tripp Lite Video Cable - P502-025,201854347,
Keyboard - Wireless - Mouse - Laser - Type A - USB - Receiver,Logitech diNovo Media Desktop Laser - 967562-0403,201935116,
Photo Cyan,Canon CLI-8PC Photo Cyan Ink Cartridge - 0624B002,201953021,13.99
Photo Magenta,Canon CLI-8PM Photo Magenta Ink Cartridge - 0625B002,201953025,13.99
Color,Canon CL-51 High Capacity Color Ink Cartridge For PIXMA MP450 PIXMA iP6210D and PIXMA iP6220D Printers - 0618B002,201953026,
Black,Canon PG-50 High Capacity Black Ink Cartridge For PIXMA MP450 Printer - 0616B002,201953029,
Color,Canon CL-52 Photo Ink Cartridge For PIXMA iP6210D and PIXMA iP6220D Printers - 0619B002,201953039,18.16
,DeLonghi DC50B Twenty Four Seven Drip Coffee Maker Black,201959840,22.95
1.4GB - 3 Pack,Panasonic DVD-RAM Media - LM-AF30U3,201965217,6.22
USB 2.0 7-PORT HUB/APPLE #TB857LL/A,Belkin Hi-Speed USB 2.0 7-Port Hub - F5U237-APL-S,202003159,
f/4 to 5.6,Canon EF 70-300mm f/4-5.6 IS USM Telephoto Zoom Lens - 0345B002,202026554,549
TV DVD Player Audio Receivers Cable Box Satellite Receiver PVR (Personal Video Recorder) - 100 ft - Universal Remote,Universal Aeros IR/RF Remote Control - MX850,202041195,256.99
TV VCR DVD Player CD Player Cable Box Satellite Receiver DVR Audio Receivers - 100 ft - Universal Remote,Universal MX-350 Osiris Remote Control - MX350,202041204,93.9
,Panasonic NN-H965BF Microwave Oven - Counter Top - 2.2ft - 1250W - Black,202045862,
,Panasonic NN-H965WF Luxury Full-Size 2-1/5-Cubic-Foot 1250-Watt Microwave Oven- White,202045875,
Linksys WRT54GL Wireless-G Broadband Router,Linksys Wireless-G WRT54GL Broadband Router,202046565,
,Audiovox XM6 Outdoor Home Antenna - XM-6,202049393,
i-TTL TTL D-TTL Manual - 65.6ft Range,Nikon Speedlight SB-600 AF Flash Light - 4802,202067544,189.72
Memory Stick Adapter - Memory Stick Duo,Sony Memory Stick Duo Replacement Adapter - MSACM2,202070149,19.48
Steel - 6ft,Kensington MicroSaver Notebook Lock - 64068F,202070807,
,Linksys Wireless-G WUSB54GC Compact USB Adapter,202104453,
42 dBi - SMB,Sirius Outdoor Home Antenna - 14240,202106724,
Ribbon Sheet,Sony Ribbon and Paper with Snap-Off Edges For DPP-FP50 Digital Photo Printer - SVMF120P,202125720,
XM Satellite Radio Receiver,Audiovox XMH10 Home Docking Kit,202139744,
XM Satellite Radio,Audiovox XMFM1 Switch Box,202139765,15.49
,Sanus VCD/DVD Wall Mount - VMAVB,202143942,
Memory Stick Memory Stick Duo,Sony Memory Stick USB Card Reader/Writer - MSACUS40,202143947,
,Logitech Harmony 890 Advanced Universal Remote - 966193-0403,202145734,248.9
Steel,Sanus Center Channel Speaker Mount - VMCC1B,202291459,
USB Network VGA DVI-D DC-in,Sony VAIO SZ Series Docking Station - VGPPRSZ1,202293522,
SVM-F40P 4'x6' Photo paper - 40-Count,Sony Print Paper - SVMF40P,202434158,17.99
,Canon Canon CB-2LW Battery Charger - 0763B001,202451162,
,Tivo AG0100 Wireless G USB Network Adapter,202456880,
,TiVo TCD649080 - Series2 Digital Video Recorder - Up to 80 Hours Capacity,202456903,
Top Loading - Leather,Canon PSC-75 Deluxe Soft Case - 0716B001,202472204,19.94
,SONY COMPACT TRIPOD 14'/39' *NIC* - VCTR100,202473822,
,Lowepro Rezo 15 Camera Case - MicroFiber Ripstop Nylon - Black (Black),202479411,
,Lowepro SlingShot 200 AW Camera Backpack - Backpack - MicroFiber Ripstop Nylon - Black Gray (Black),202479417,
,Lowepro Edit 100 Case for Camcorder - Nylon MicroFiber - Black (Black),202479418,
,GE Millennium TV Antenna - 24734,202486964,
,Lego Star Wars 2: The Original Trilogy,202502745,
,Uniden TCX905 Tru-Digital Expansion Handset With Caller ID,202515446,29.99
Panasonic KX-TGA450B Additional Handset for PANKXTG4500B,Panasonic KX-TGA450B Cordless Handset,202537952,
4 x Phone Line(s) - Black,Panasonic KX-TG4500B Corded/Cordless Telephone,202537962,
Panasonic KX-TG6700B 5.8 GHz 2-Line FHSS GigaRange Expandable Digital Cordless Phone with Answering System & Call Waiting Caller ID,Panasonic KX-TG6700B Cordless Telephone,202537967,106.14
Panasonic KX-TGA670B Additional Handset for PANKXTG6700B,Panasonic KX-TGA670B Cordless Handset,202537969,
Cross Cut - 11 Per Pass - 5.5 Gallon Wastebasket,Fellowes Powershred Personal W11C Shredder - 30100,202592070,
SMB - 50ft,Directed Electronics Antenna Extension Cable - 14230,202592699,
,Weber Q 300 Gas Grill,202619749,
TV DVD Player VCR CD Player Satellite Receiver DVR - 32.81 ft - Universal Remote,Sony Learning Remote Control - RMVL600,202635467,19.99
1 x Phone Line(s) - 1 x Headset 1 x Data - White,Panasonic KX-TS600W Basic Telephone,202755491,
Pioneer Electronics CD-MR80D Wired Marine Remote Control with Display,Pioneer Nautica Marine Remote Control,202778257,
Pioneer Electronics GEXP920XM XM Digital Satellite Tuner for Pioneer Headunits,Pioneer GEX-P920XM XM Digital Satellite Tuner - GEX-P920XM,202778315,
Pioneer Electronics TS-P462 4' x 6' 2-Way Component Plate Speaker with 150 Watts Maximum Power,Pioneer TS-P462 Speaker,202784218,
Pioneer Electronics TSMR1640 Nautica Series 6-1/2' Marine-Use 2-Way Speaker with 160 Watts Max. Power,Pioneer Nautica TS-MR1640 Marine Speaker - TS-MR1640,202784323,
Canon NB-5L Lithium Ion Battery,Canon NB-5L Lithium-Ion Digital Camera Battery - 1135B001,202785722,36.49
Speaker - Magnetically Shielded,Boss 161 Speaker,202812567,158
2.1-channel - Black,Bose Acoustimass 5 Series III Speaker System - 21725,202812620,359
DVD Player TV VCR Tuner Amplifier CD Player Cable Box Satellite Receiver PVR (Personal Video Recorder) - 80 ft - DVD Player Remote,Bose PMCII Remote Control,202812646,145.37
mini-DVI Male to 24-pin DVI-D (Digital) Male,Apple DVI to mini-DVI Video Cable Adapter - M9321GB,202813304,19.99
Steel - 200 lb,Peerless PLAV70-UNLP-S Articulating Dual-Arm with Vertical Adjustment - PLAV70 UNLPS,202827677,449.52
Steel Aluminum - 100 lb,Sanus VisionMount Flat Panel TV Wall Mount - MF110-B1,202827684,
Steel - 100 lb,Sanus VisionMount Flat Panel TV Wall Mount - ML22-B1,202827713,
Steel - 100 lb,Sanus VisionMount Tilting Flat Panel TV Wall Mount - MT25-B1,202827715,
,Panasonic SDYD250 Automatic Bread Maker,202845629,
Top Loading - Leather - Black,Canon PSC-55 Deluxe Leather Camera Case - 1588B001,202861078,16.82
,Garmin GA 25MCX Low Profile Remote GPS Antenna - 010-10702-00,202870170,
,CHARGE YOUR UNIT WITH THIS AC ADAPTER CABLE. ALSO INCLUDES INTERNATIONAL ADAPTER - 010-10723-00,202870171,
1 x Type A USB,Garmin USB Cable - 010-10723-01,202870172,8.15
Garmin 010-10723-02 - Leather GPS Case,Garmin Leather GPS Case,202870173,
Garmin 010-10723-03 - Vehicle Suction Cup Mount,Garmin Vehicle Suction Cup mount,202870174,
Garmin 010-10723-06 - Cigarette Lighter Adapter for GPS - 12V DC,Garmin Cigarette Lighter Adapter for GPS,202870177,
,Garmin Cigarette Lighter Adapter for GPS Navigation - 010-10747-03,202870184,12.99
SHARP Over-the-Counter Stainless Mircowave Oven - R1214,Sharp R-1214 Microwave Oven - R-1214,202870448,380.67
Linksys Wireless-N Access Point with Power Over Ethernet High-Speed Wireless Access for Existing Networks!,Linksys WAP4400N Wireless-N Access Point With POE - WAP4400N,202882380,
4 x LAN,Linksys Wireless-N WRVS4400N Gigabit Security Router with VPN,202899626,
Lithium Ion (Li-Ion) - 3.7V DC - Photo Battery,Panasonic CGA-S007A/1B Lithium Ion Digital Camera Battery,202899996,
Color - CCD - Cable,Panasonic BB-HCM331A Outdoor Network Camera with 2-Way Audio,202899998,
,Panasonic BL-C1A Network Camera,202900002,
Panasonic Plain Paper Fax/Copier with 2.4GHz FHSS GigaRange Cordless Phone and Digital Answering System,Panasonic KX-FG2451 Plain Paper Thermal Transfer Fax/Copier - KX-FG2451,202900025,
2 x Phone Line(s) - Headset - White,Panasonic KX-TS3282W Corded Telephone,202900030,
,Panasonic NN-C994S Genius Prestige Convection Microwave Oven with Inverter Turbo Defrost and One-Touch Sensor Cooking Stainless,202900041,
2 x Phone Line(s) - Headset - White,Panasonic KX-TSC14W 2-Line Telephone,202900227,
,Microsoft Office 2007 Home and Student - 79G-00007,202916534,82.99
,Microsoft Office 2007 Standard - 021-07746,202916547,319.99
Glass Wood - Black,Techcraft Veneto Series ABS32 TV Stand,202973389,150.13
Wood Glass - Brown,Techcraft Veneto Series SWP48 TV Stand,202973396,299
,LG Electronics RLM20K Remote Laundry Monitoring System,202985798,
,LG Electronics WDP3 Laundry Pedestal with Drawer - Blue,202985803,
,LG Electronics LG WSTK1 Washer/Dryer Stacking Kit: White,202985806,
,Nintendo DS Lite (Black Onyx) - USGSKB,202985950,
CMOS - USB,Logitech QuickCam Communicate STX Webcam - Black Charcoal - 961464-0403,202989028,
XM Satellite Radio Receiver,Audiovox CNP2000 XM Mini-Tuner,203017911,
XM Satellite Radio,Audiovox CNP2000H XM Mini-Tuner Home Dock,203017912,24.74
40,Denon TU-1500RD Stereo Radio Tuner - TU1500RD,203017999,
Lithium Ion (Li-Ion) - 7.4V DC - Portable DVD Player Battery,Toshiba Lithium Ion Portable DVD Player Battery - MEDB05LX,203021705,149.99
Car Audio System - Car Audio Remote,Pioneer Car Audio Remote Control - CDVC1,203022202,35
CD-ROM CD-R CD-RW - CD-Text Playback - 5 Disc(s),Sony SCD-CE595 CD Player - SCDCE595,203022472,
CD-ROM CD-R CD-RW - 5 Disc(s) - 32 Programmable Track(s),Sony CDP-CE375 CD Player/Changer - CDPCE375,203023505,114.18
Belt Drive,Denon DP-29F Analog Record Turntable - DP29F,203024425,
CD-R CD-RW CD-ROM - MP3 CD-Text Playback - 400 Disc(s) - 32 Programmable Track(s),Sony CDP-CX455 CD Player/Changer - CDPCX455,203024998,219.99
,Cordless Solo S2 Radar/Laser Detector - 010ES20A,203025174,279.99
CD-RW - CD-Text,Kenwood KDC-C669 Car CD Changer - KDCC669,203025423,
,Kenwood KCA-IP500 iPod Interface/Controller - KCAIP500,203025446,47.72
CD-R CD-RW CD-ROM - CD-Text MP3 Playback - 5 Disc(s) - 24 Programmable Track(s),Sony Compact Disc Player/Recorder - RCDW500C,203025617,219.76
USB - RJ-11 Phoneline - 56 Kbps,Apple V.92 Data/Fax USB Modem - MA034ZA,203065730,49
Audio/Video TV VCR DVD Player CD Player Cable Box DVR Audio System Tape Deck PC Satellite Radio iPod Xbox 360 Lighting System - 50 ft 100 ft - Universal Remote,Universal MasterControl Universal Learning Remote Control - RF20,203069939,
,Garmin GPS Receiver Dash Mount - 010-10613-00,203086405,
TV VCR DVD Player Cable Box Satellite Receiver Amplifier CD Player DVR - 23 ft - Universal Remote,Sony Remote Control - RMV310,203086857,14.72
,GE Pre-Amplifier for Stereo Turntable - 23292,203087319,23.72
,Denon DCM-390 5 Disc CD Changer - DCM390,203087638,348
Belt Drive,Denon DP-300F Analog Record Turntable - DP300F,203087681,328.99
,Garmin Vehicle Suction Mount - 010-10609-00,203087865,27.59
DVD+RW DVD-RW CD-RW - DVD Video Video CD SVCD SACD MP3 JPEG Playback - 400 Disc(s) - Progressive Scan - Black,Sony DVPCX995V DVD Player,203088013,249.99
,Cuisinart Cordless Automatic Electric Kettle,203111113,69.95
,Twin Tub DTT420 Washer (Top Loading 10 Lbs.),203111424,312.04
,KitchenAid Pasta Roller And Cutter - KPRA,203111433,
,LG Electronics 24' Front-Load All-In-One Washer and Dryer: Titanium,203131412,
,LG Electronics 24' Washer/Dryer Combo: White,203131413,
Aluminum,Griffin Elevator Desktop Stand for Portable Laptops - 1093-CURV2,203131635,
,LG Electronics 10 cu.ft. Cabinet Depth Refrigerator,203136102,
,LG Electronics LRBP1031W 10 Cu. Ft. Refrigerator,203136103,
,LG Navy Blue SteamWasher 27',203136113,
17-in-1 - Memory Stick Duo Memory Stick MagicGate Duo Memory Stick PRO Memory Stick PRO MagicGate miniSD Card MultiMediaCard (MMC) RS-MMC CompactFlash (CF) Card Secure Digital (SD) Card Smar,Sony 17-in-1 External USB Memory Card Reader And Writer - MRW62E/S1/181,203142438,
,DIRECTDECK UNIVERSAL CASSETTE ADAPTER FOR MP3 PLAYERS - 7256-DDECK,203142471,
,DDW1805W 18-in. Portable Dishwasher (White Energy Star),203150909,474.36
,White .5 cu. ft 1500 Watt Convection/Broiler/Toaster Oven,203151776,149
,DeLonghi 6-pc. Replacement Filters for Deep Fryer,203151779,
,DeLonghi 4-Cup Drip Coffee Makers,203151930,
,Harmony EL6985A Vacuum (Canister HEPA),203154818,
,Cuisinart GR-4 Griddler Four Multifunctional Cooking Options,203155653,129
,Cuisinart Brew & Serve Stainless Therm Black 10-Cup Coffee Maker,203162678,99.95
- Orange,Belkin CushTop - F8N044-ORG,203165921,
- Green,Belkin CushTop - F8N044-GRN,203165922,
- Silver,Belkin CushTop - F8N044-SLV,203166120,
Black,Canon PG-40 Black Ink Cartridge - PG-40-BK-TWIN,203185276,41.46
,DCC-2000 Coffee Maker (12 Cup Stainless Steel),203198950,99.95
,Hoover EmPower U5269-900 Vacuum (Upright HEPA Bagless),203199121,
Top Loading - Neoprene - Black,Olympus Neoprene Soft Camera Case - 202066,203201060,11.89
Power Accessory Kit,Canon Battery and Charger Kit - 1169B001,203201062,
XS - FM Transmitter - 6 Lines LCD,Directed Electronics Sportster 4 Sirius Satellite Radio Receiver - SP4TK1,203308084,169.99
Panasonic All-in-One All-in-One Flatbed Laser Fax,Panasonic KX-FLB801 Multifunction Printer - KX-FLB801,203322272,
DVD+RW DVD-RW CD-RW - DVD Video DVD Audio SACD Video CD Picture CD JPEG WMA PCM HDCD MP3 MPEG-1 MPEG-2 MPEG-4 DivX Playback - 1 Disc(s) - Progressive Scan - Black,Denon DVD-2930CI DVD Player - DVD2930CI,203324800,448
,OmniMount MWFS Moda Collection 2 Shelf Wall Mounted Furniture System - Espresso,203324914,158.16
Sirius Satellite Radio Receiver,Directed Electronics SUPV1 Car Kit,203324965,
Sirius Satellite Radio Receiver,Sirius SUPH1 Sirius Universal Home Kit,203324970,44.99
,Logitech Harmony 1000 Advanced Universal Remote Control - 966230-0403,203329569,
USB,Logitech diNovo Edge Keyboard - 967685-0403,203329570,
Nikon EN-EL3e Rechargeable Li-ion Battery,Nikon EN-EL3e Lithium Ion Digital Camera Battery - 25334,203340101,34.24
0.28x - 55mm to 200mm - f/4 to 5.6,Nikon 55-200mm f/4-5.6G ED AF-S DX Telephoto Zoom Lens - 55200MMLENS,203340555,124.95
Top Loading - Polypropylene - Black,Sony LCS-CSH Soft Camera Case - LCSCSH,203340806,
Leather - Black,Olympus Slim Leather Case - 202087,203341506,18.99
f/4 to 5.6,Canon EF 75-300mm f/4-5.6 III Telephoto Zoom Lens - 6473A003,203343197,159.95
Camcorder Starter Kit,Canon Mini DV Camcorder Starter Kit - 9582A008,203347464,69.95
,LG Electronics DLE0442W XL Load Capacity with NeveRust Stainless Steel Drum,203379234,
,LG Electronics DLG0452W 7.3 Cu. Ft. 9-Cycle Gas Dryer,203379237,
,LG Electronics WDP3 Laundry Pedestal with Drawer -W/ B/ S/ N / WDP3R - Wild Cherry,203379249,
,LG Electronics WM0642HW Front Load Washing Machine with 7 Washing Programs,203379250,
Black Cyan Magenta Yellow Light Cyan Light Magenta,Canon BCI-6 Color Ink Cartridges - 4705A018,203388440,59.99
XS - FM Transmitter - 5 Lines LCD,Directed Electronics Starmate 4 Sirius Satellite Radio Receiver - ST4TK1,203388612,104.93
,OmniMount 3-Shelf Large-Component Tower - STELLARG303G,203389382,
Lithium Ion (Li-Ion) - 3.7V DC - Photo Battery,Olympus LI-42B Lithium Ion Digital Camera Battery - 202034,203389465,
,Canon CB-2LX Battery Charger - 1133B001,203396159,
f/4.5 to 5.6,Nikon Nikkor 70-300mm f/4.5-5.6G ED-IF AF-S VR Telephoto Zoom Lens - 2161,203396327,449
Micro Cut - 7 Per Pass,Fellowes MicroShred MS-450Cs Shredder - 3245001,203405814,185.99
Cross Cut - 17 Per Pass,Fellowes Powershred Personal SB-97Cs Confetti Cut Shredder - 3219701,203405815,240.67
,PlayStation 3 ChargeLink USB Charging Cable by Nyko - 83000,203407043,
,Nyko PS3 Dual AC Charger - 83015,203407045,
1 GB,Sony 1GB Memory Stick Micro (M2) Card - MSA1GD,203445749,21.47
,Monster Game 127961 GameLink(tm) 2M HDMI Digital Video/Audio Cable for PS3,203445879,45.79
- Black,Bose In-Ear Earphone - INEARHEADPHONES,203459314,99.95
Panasonic Slim Cabinet Plain Paper Fax/Copier with All-digital Answering System,Panasonic KX-FP145 Plain Paper Thermal Transfer Fax/Copier - KXFP145,203472622,94.88
,Oregon Scientific Helmet Video Camera - ATC-2000,203474227,81.74
,Waring Pro Deep Fryer 3qt -Black,203491687,
Red,Canon CLI-8 Red Ink Tank For PIXMA Pro9000 Printer - 0626B002,203514304,15.75
Green,Canon CLI-8 Green Ink Tank For PIXMA Pro 9000 Printer - 0627B002,203514305,12.85
1 x 10/100Base-TX Network 1 x USB - Wi-Fi - IEEE 802.11b/g,Linksys WPSM54G Wireless-G USB Print Server,203514371,
,Monster Cable GameLink Component Video and Fiber Optic Digital Audio Cable for PlayStation 3 - 3 x RCA - Toslink - 10ft - PS3 CV/FO-10,203651765,
,Garmin Suction Cup Mount - 010-10823-00,203870569,24.84
SIRIUS SCH1 SIRIUSConnect Home Tuner,Directed Electronics SCH1 SiriusConnect Home Tuner,203884610,54.92
,Panasonic Srtmb10/Rice Cooker/5.5cup/Fuzzy - SR-TMB10,203888987,
,KitchenAid 5-Speed Blender - Red Finish - KSB560ER,203897877,106.98
,ABS48 Wood TV Stand (Avalon Series 48-in. Max),203900180,
Wood - Walnut,Techcraft SWP60 Classic Wood Tone Credenza TV Stand,203900792,
,PLD4375RFC Professional SpeedClean 24-in. Under Counter Dishwasher (14 Place Settings Stainless Steel),203915639,543.29
,Bose SL2 Wireless Surround Link,203921172,249
6.56ft - 1 x IP-Bus 1 x Proprietary - Audio Cable,Pioneer iBus Interface Cable for iPod - CD-I200,203922244,26.5
,SIRIUS FMDA25 Wired FM Relay Kit,203928709,
,Sony Playstation 3 Blu-Ray DVD Remote - 98046,203930685,18.44
Glass - Black,Peerless SGLB01 Flat Panel TV Stand,203934122,
,Transcend 8GB JetFlash V10 USB Flash Drive - TS8GJFV10,203938179,14.5
Transcend 4GB SDHC Class 6 Secure Digital High Capacity Card,Transcend 4GB Secure Digital High Capacity (SDHC) Card - Class 6 - TS4GSDHC6,203952966,5.74
,Sharp Plasmacluster FP-P35CX Air Purifier - 129Sq. ft.,204020411,
2 GB,Transcend 2GB microSD Card - TS2GUSD,204035273,1.75
2-way Speaker 125W (RMS) - White,polkaudio TCi Series TC60i In-Ceiling Loudspeaker - TC60iW,204049431,132.83
200 lb,OmniMount Wishbone Large/X-Large Premium Cantilever Mount and Universal Adapter - UCL-XB,204049534,292.92
Lithium Ion (Li-Ion) - 7.4V DC - Photo Battery,Nikon EN-EL9 Lithium Ion Digital Camera Battery Pack - 25353,204049780,35.65
Top Loading - Leather,Garmin Leather Carry Case for Nuvi 660 - 010-10823-01,204053338,9.28
