description,name,entityUrl,price
Flip Video Mino 60 min Black,Pure Digital Flip Mino Digital Camcorder - F360B,208171630,
Flip Video Mino 60 min White,Pure Digital Flip Mino Digital Camcorder - F360W,208171631,
,Samsung HL72A650 - 72' Widescreen 1080p DLP HDTV - 2500:1 Contrast Ratio,208171946,2188.70
5 x AM 10 x FM,Boston Acoustics Horizon Duo-i AM/FM Stereo Radio - HDUOIMDNT,208177785,135.52
1GB Flash Memory - White,Samsung YP-S2ZW 1GB Flash MP3 Player - YP-S2ZW/XAA,208184891,29.67
1GB Flash Memory - Green,Samsung YP-S2ZW 1GB Flash MP3 Player - YP-S2ZG/XAA,208184892,29.67
,Onkyo CS-325 Stereo CD Receiver Mini Audio System,208186248,238.72
Canon SELPHY CP760 Compact Photo Printer,Canon SELPHY CP760 Dye Sublimation Printer - 2565B001,208190046,90.1
,Maytag MMV4205BAQ Over-the-Range Microwave,208226457,
,Maytag 2.0 Cu. Ft. Over-the-Range Microwave Oven,208226458,
,Linksys WRT610N Simultaneous Dual-N Band Wireless Router,208226470,
Plastic - Black,Speck Products SeeThru Case for Apple 13' MacBook - MB13-BLK-SEE-V2,208226689,
Plastic - Clear,Speck Products SeeThru Case for Apple 15' MacBook Pro - MB15-CLR-SEE-V2,208226690,
Plastic - Pink,Speck Products SeeThru Case for Apple 15' MacBook Pro - MB15-PNK-SEE-V2,208226692,
Plastic - Clear,Speck Products SeeThru Case for Apple 13' MacBook - MB13-CLR-SEE-V2,208226693,
Plastic - Red,Speck Products SeeThru Case for Apple 13' MacBook - MB13-RED-SEE-V2,208226694,
Plastic - Blue,Speck Products SeeThru Case for Apple 13' MacBook - MB13-BLU-SEE-V2,208226695,
Plastic - Pink,Speck Products SeeThru Case for Apple 13' MacBook - MB13-PNK-SEE-V2,208226696,
Plastic - Green,Speck Products SeeThru Case for Apple 13' MacBook - MB13-GRN-SEE-V2,208226697,
Plastic - Blue,Speck Products SeeThru Case for Apple 15' MacBook Pro - MB15-BLU-SEE-V2,208226698,34.74
Plastic - Orange,Speck Products SeeThru Case for Apple 13' MacBook - MB13-ORG-SEE-V2,208226699,
Plastic - Aqua,Speck Products SeeThru Case for Apple 13' MacBook - MB13-AQU-SEE-V2,208226700,
Plastic - Green,Speck Products SeeThru Case for Apple 15' MacBook Pro - MB15-GRN-SEE-V2,208237792,
Plastic - Orange,Speck Products SeeThru Case for Apple 15' MacBook Pro - MB15-ORG-SEE-V2,208237793,
Plastic - Purple,Speck Products SeeThru Case for Apple 15' MacBook Pro - MB15-PUR-SEE-V2,208237795,31.97
Black,Bracketron Low-Pro Windshield Mount - SWM-400-BL,208270234,
,Ge 24746 Futura(tm) Indoor Hdtv Antenna,208280406,29.72
,BlueAnt Wireless Z9i Bluetooth Headset - Black - US-091010,208289950,59.99
DVD Player 5.1 Speakers - 900W RMS - DTS Dolby Digital Dolby Pro Logic II,Sony HT-DDWG700 Home Theater System - HTDDWG700,208289990,206.96
DVD-R CD-R VHS - DVD Video Playback - 1 Disc(s) - Black,Sony RDR-VX560 DVD/VCR Combo,208289993,176.08
4 GB,Transcend 4GB microSDHC Card (Class 6) - TS4GUSDHC6,208289997,6.85
26' - ATSC NTSC - 16:9 - 1366 x 768 - HDTV,Sony BRAVIA M Series KDL-26M4000 26' LCD TV - KDL26M4000,208294698,538.72
,Samsung BDP-1500 Blu-ray DVD Player - BDP1500,208294701,218.2
,LG 37LG50 - 37' Widescreen 1080p LCD HDTV - 15000:1 Dynamic Contrast Ratio - 5ms Response Time,208294712,
Dolby Digital Plus Dolby TrueHD DTS-HD,Onkyo TXSR606 A/V Receiver,208294715,399.95
65' - DLP - 16:9 - 1920 x 1080 - Dolby,Mitsubishi WD-65735 65' Projection TV - WD65735,208294716,1401.26
46' - ATSC NTSC - 16:9 - 1920 x 1080 - HDTV,Sony BRAVIA S Series KDL-46S4100 46' LCD TV - KDL46S4100,208294717,1188.65
32' - ATSC NTSC - 16:9 - 1366 x 768 - HDTV,Sony BRAVIA KDL-32L4000 32' LCD TV - KDL32L4000,208294718,597.72
,LG 32LG30 - 32' Widescreen 720p LCD HDTV - 12000:1 Dynamic Contrast Ratio - 8ms Response Time,208294720,
65' - DLP - HDTV Ready,Mitsubishi WD-65736 65' Projection TV - WD65736,208294722,1309.56
46' - ATSC NTSC - 16:9 - 1920 x 1080 - HDTV,Panasonic Viera TH-46PZ850U 46' Plasma TV - TH46PZ850U,208294724,1695.96
8.1 Megapixel - 16:9 - 2x Digital Zoom - 2.7' Active Matrix TFT Color LCD,Sony Cyber-shot DSC-W150 Digital Camera - Silver - DSCW150,208294727,129.99
,Frigidaire FDB130RGS 24' Built-In Dishwasher (White),208294904,246.54
13.6 Megapixel - 16:9 - 3x Optical Zoom - 2x Digital Zoom - 2.7' Color LCD,Sony Cyber-shot DSC-W300 Digital Camera,208294927,289
,Cuisinart TOB-155 Toaster Oven Broiler,208294970,139
CD-R CD-RW - CD-DA MP3 WMA AAC - 4 - 200W - FM AM,ALPINE CDA-9886 Car Audio Player - CDA9886,208295050,
,Samsung HT-X710 Bluetooth 400-Watt Home Theater System With iPod Dock,208296017,
Griffin Elan Form iPhone 3G - Blk,Griffin Elan Form for iPhone 3G - 8223-IP2EFRMB,208342520,
Griffin Wave iPhone 3G - Black,Griffin Protective Wave Case for Smart Phone - 8227-IP2WVB,208342524,
,CHOPS HANGER - HEADPHONE - WIRED - EARBUDS - 18 - 20000 HZ - BLACK AND CHROME - HH26-SKC01,208344063,17.99
,3G iPhone Black ToughSkin - IPH3G-BLK-TS,208370418,10
,Yamaha YSP-3050 Digital Sound Projector - YSP-3050BL,208409750,749.99
,SDI Technologies IP99BR8 Clock Radio For iPod/iPhone,208409785,
,Nintendo DS Lite (Metallic Silver),208410812,139.99
Sony VAIO Z550N/B Intel Centrino 2 Core 2 Duo P8600 2.40GHz Notebook 3GB DDR3 SDRAM 250GB SATA HD 13.1' LCD DVDR DL/DVDRW/RAM Modem Gigabit NIC 802.11a/b/g/n Sprint Mobile Bluetooth Vista Business SP1/XP downgrade,Sony Z550N/B Notebook - VGNZ550N/B,208453643,
Intel Centrino 2 Core 2 Duo P9500 2.53GHz - 13.1' - 3GB DDR3 SDRAM - 320GB HDD - DVD-Writer (DVD-RAM/R/RW) - Bluetooth Gigabit Ethernet Wi-Fi - Windows Vista Business - Black,Sony Z570N/B Notebook - VGNZ570N/B,208453646,
Sony VAIO Z591U/B Laptop Intel Centrino 2 Core 2 Duo P9500 2.53GHz 4GB DDR3 320GB SATA HDD 13.1' LCD BR-ROM/DVDRW 802.11a/b/g/n Bluetooth Windows Vista Ultimate,Sony Z591U/B Notebook - VGNZ591U/B,208453648,2849.99
,Frigidarie GLD4355RF 24' Gallery Speed Clean Dishwasher (Black),208455791,451.29
,Frigidaire GLD4355RFS Gallery Series 24' Under Counter Dishwasher,208455792,443.81
,Sony XT-100HD HD Radio Tuner,208455891,38
DVD Player Amplifier 5.1 Speakers - 5 Disc(s) - Progressive Scan - 1000W RMS - Dolby Pro Logic II,Sony BRAVIA DAV-HDX576WF Home Theater System,208455893,478.72
 3.1 Speakers - Progressive Scan - 250W RMS,Sony HT-CT100 Home Theater System,208455894,279.95
,Sony ICF-CD73W AM/FM/Weather Shower CD Clock Radio (White),208455896,68.96
8' LCD - DVD+RW DVD-RW DVD+R DVD-R CD-RW - DVD Video CD-DA MP3 JPEG Playback - 1 Disc(s) - Pink,Sony DVP-FX820/P Portable DVD Player - DVPFX820/P,208455897,148.72
6.5' Active Matrix TFT LCD - DVD-RW DVD+RW CD-RW - DVD Video DVD Audio Video CD CD-DA MP3 WMA AAC MPEG-1 MPEG-2 - 200W FM AM,ALPINE IVA-W205 Car Video Player,208456130,689.96
,Whirlpool WFW8300SW 27' Front-Load Washer w/3.4 Cu. Ft. Capacity (White),208456185,668.75
,Whirlpool WTW6400SW Cabrio 4.5 Cu Ft Capacity Washer (White),208456199,819.75
,Whirlpool DU1055XTSS 6' Console Undercounter Dishwasher (Stainless Steel),208456203,359
,Whirlpool 27' DUET WASHER HORIZ AXIS WP,208456215,910.91
,Whirlpool WTW6700TW 28' Cabrio Series Top Loader Washer (Metallic/White),208456233,925.91
,Whirlpool WTW6700TU Cabrio 4.6 Cu. Ft. Top Load Washer (Diamond Dust),208456262,1029.75
Canon EOS Rebel XS Digital SLR Camera with 10 Megapixel 2.5' LCD 3 Frames Per Sec & Live View Mode - Black,Canon EOS Rebel XS Digital SLR Camera with EF-S 18-55mm 1:3.5-5.6 IS Lens - Black - 2762B003,208464207,461.96
,Weber Summit E-620 Copper LP Gas Grill,208464825,
,Weber Summit SP-320 Stainless LP Gas Grill,208464828,
,Weber Genesis EP-320 Blue LP Gas Grill,208464837,
50' - ATSC NTSC - 16:9 - 1920 x 1080 - HDTV,Panasonic Viera TH-50PZ850U 50' Plasma TV,208504045,2096.99
8' LCD - DVD+RW DVD-RW DVD+R DVD-R CD-RW - DVD Video MP3 JPEG Playback - 1 Disc(s) - Progressive Scan - White,Sony DVPFX820 Portable DVD Player - DVPFX820/W,208504099,149
8.1 Megapixel - 16:9 - 2x Digital Zoom - 2.7' Active Matrix TFT Color LCD,Sony Cyber-shot DSC-W150 Digital Camera - Black - DSCW150/B,208504178,129.99
BD-R DVD-RW CD-RW Secure Digital (SD) - DVD Video CD-DA MP3 WMA JPEG DivX 6 PCM Playback - Progressive Scan,Denon DVD-3800BDCI Blu-ray Disc Player - DVD3800BDCI,208504179,
32' - ATSC NTSC - 16:9 - 1920 x 1080 - Dolby Surround - HDTV,Sony BRAVIA KDL32XBR6 32' LCD TV,208504187,998.72
,Panasonic KXTH1212B,208504190,79.99
60' - DLP - HDTV Ready,Mitsubishi WD-60735 60' Projection TV,208504191,1288.00
37' - Active Matrix TFT - ATSC NTSC NTSC-M - 16:9 - 1920 x 1080 - Surround - HDTV - 1080i 1080p,Sony BRAVIA XBR Series KDL-37XBR6 37' LCD TV - KDL37XBR6,208504297,1197.66
 A/V Receiver 7.1 Speakers - 1200W RMS - Dolby Pro Logic IIx Dolby Digital Dolby Digital EX DTS DTS-ES DTS Neo:6 DTS 96/24 - Black,Onkyo HTS5100 Home Theater System - HTS5100B,208504300,478.72
DVD Player A/V Receiver 5.1 Speakers - 1 Disc(s) - Progressive Scan - 1000W RMS - Dolby Digital Dolby Pro Logic Dolby Pro Logic II DTS,Sony HT7200DH Home Theater System,208504304,376.96
Dolby Digital Dolby Pro Logic II DTS 96/24 DTS Neo:6 Dolby Digital EX Dolby Pro Logic IIx Dolby Pro Logic DTS-ES Digital Cinema Sound DTS,Sony STR-DG820 A/V Receiver - STRDG820,208504307,318.72
40' - ATSC NTSC - 16:9 - 1920 x 1080 - Dolby Surround - HDTV - 1080i 1080p,Sony BRAVIA Z Series KDL-40Z4100 40' LCD TV - KDL40Z4100/B,208504318,1327.47
46' - ATSC NTSC - 16:9 - 1920 x 1080 - Dolby - HDTV - 1080i 1080p,Sony BRAVIA Z Series KDL-46Z4100 46' LCD TV - KDL46Z4100/B,208504334,1687.98
32' - ATSC NTSC - 16:9 - 1366 x 768 - HDTV,Sony BRAVIA M Series KDL-32M4000 32' LCD TV - KDL32M4000,208504339,639.95
46' - ATSC NTSC - 16:9 - 1920 x 1080 - HDTV,Sony BRAVIA W Series KDL-46W4100 46' LCD TV - KDL46W4100,208504340,1399.99
52' - ATSC NTSC - 16:9 - 1920 x 1080 - HDTV,Sony BRAVIA V Series KDL-52V4100 52' LCD TV - KDL52V4100,208504345,1599.00
LG 52LG50 - 52' Widescreen 1080p LCD HDTV - 15000:1 Dynamic Contrast Ratio - 6ms Response Time,LG 52LG50 52' LCD TV,208504369,
LG 47LG50 - 47' Widescreen 1080p LCD HDTV - 15000:1 Dynamic Contrast Ratio - 5ms Response Time,LG 47LG50 47' LCD TV,208504370,
LG 32LG40 - 32' Widescreen 720p LCD HDTV w/ Built-in DVD Player - 12000:1 Dynamic Contrast Ratio - 8ms Response Time,LG 32LG40 32' TV/DVD Combo,208504378,
,Mitsubishi MB-S73 TV Stand,208504394,499
73' - DLP,Mitsubishi Diamond WD-73835 73' Projection TV - WD73835,208504396,3299.00
LG 52LG70 - 52' Widescreen 1080p LCD HDTV - 120Hz - 15000:1 Dynamic Contrast Ratio - 4ms Response Time,LG LG70 Series 52LG70 52' LCD TV,208504407,
52' - 16:9 - 1920 x 1080 - HDTV,Sony BRAVIA W Series KDL-52W4100 52' LCD TV - KDL52W4100,208504421,1998.72
65' - DLP,Mitsubishi Diamond WD-65835 65' Projection TV,208504422,2399.00
Dolby Digital Dolby Pro Logic II DTS 96/24 DTS Neo:6 Dolby Digital EX Dolby Pro Logic IIx Dolby Pro Logic DTS-ES Digital Cinema Sound DTSFM AM XM,Sony STR-DG920 A/V Receiver - STRDG920,208504423,404.07
Dolby Digital Surround Dolby Pro Logic IIx DTS-ES DTS Neo:6 DTS 96/24FM AM,Denon AVR-1609 A/V Receiver - AVR1609,208504429,348
Dolby Digital Surround DTS-ES DTS Neo:6 DTS 96/24 Dolby Pro Logic IIxFM AM,Denon AVR-1709 A/V Receiver - AVR1709,208504432,448
12.1 Megapixel - 3' Active Matrix TFT Color LCD,Nikon D700 Digtal SLR Camera - 25444,208504437,2699.00
,Klipsch KS7502THX (Each) - KS-7502-THX,208504461,1000.00
Photo Viewer - 7' LCD,Sony DPFD70 Digital Photo Frame,208653765,107.58
Photo Viewer - 9' LCD,Sony DPFV900 Digital Photo Frame - DPF-V900,208653767,199.95
,Sony Picture Station Digital Photo Printer - DPPFP95,208653775,
8 Megapixel - 16:9 - 3x Optical Zoom - 4x Digital Zoom - 2.5' Color LCD,Olympus FE-360 Digital Camera - Pink - 226540,208656495,104.95
Olympus FE-370 8 Megapixel Digital Camera w/ Dual Image Stabilization 5x optical zoom 2.7 LCD Face Detection & 19 easy-to-use Shooting Modes - Silver,Olympus FE-370 Digital Camera - Silver - 226420,208656497,129.95
DVD+RW DVD-R DVD-RAM CD-RW - DVD Video CD-DA Video CD Playback - 1 Disc(s) - Progressive Scan,Sony RDR-GX360 DVD Player/Recorder,208670546,109.99
,Sony BDP-S550 - Blu-ray DVD Player,208670548,322.7
,Samsung HT-BD2T Blu-ray 7.1 Home Theater System - Blu-ray DVD & CD Playback FM Receiver w/30 Station Presets 1100W Total Output 4 Tower Speakers & Subwoofer - HT-BD2T/XAA,208688474,
,Samsung LN46A850 - 46' 1080P LCD HDTV - 50000:1 Dynamic Contrast Ratio - 120Hz - 4ms Response Time - Super Slim 1.9' Thick!,208710842,1769.00
,Samsung LN52A850 - 52' 1080P LCD HDTV - 50000:1 Dynamic Contrast Ratio - 120Hz - 4ms Response Time - Super Slim 1.9' Thick!,208710844,2399.98
,7.0 Cu. Ft. Super Capacity Electric Dryer - MED5900TW,208715736,479
,Full Console Dishwasher with 4 Automatic Cycles - DU1055XTSB,208715747,378.29
,Pedistal for Duet Sport Electric Washer/Dryer - WHP1000SQ,208715855,174.29
,Samsung PN63A650 - 63' Widescreen 1080p Plasma HDTV - 1000000:1 Dynamic Contrast Ratio - Touch of Color Design - PN63A650T,208742932,3448.00
,Dlo 004-0107 Hybridshell(tm) For Iphone(tm) 3g,208787116,
,15' LCD HDTV/DVD Combo Black - 15LV505,208791918,
21.9' - LCD - Active Matrix - ATSC NTSC - 16:9 - 1680 x 1050 - - HDTV - DVD-R DVD-RW CD-R CD-RW - 720p,Toshiba 22LV506 22' TV/DVD Combo,208791919,
DVD-RW CD-RW - DVD Video CD-DA JPEG WMA MP3 PCM Playback - Progressive Scan,Toshiba XD-E500 Upconversion DVD Player,208791921,81.96
VHS DVD-RW CD-RW - DVD Video Video CD WMA MP3 JPEG DivX SQPB Playback - 1 Disc(s) - Progressive Scan - Black,Toshiba SD-V296 DVD/VCR Combo,208791922,
10.1 Megapixel - 16:9 - 2x Digital Zoom - 2.7' Active Matrix TFT Color LCD,Sony Cyber-shot DSC-W170 Digital Camera - Silver - DSCW170,208792604,
,Jabra BT2070 Bluetooth Headset - 100-92070000-02,208809705,
,Logitech diNovo Edge Mac Edition - 920-000924,208890628,
,Panasonic HD 3MOS 60GB Hard Disk Drive/SD Hybrid Camcorder with Advanced Optical Image Stabilizer Leica Lens 12x Optical Zoom 2.7' Wide LCD and Records to Internal Hard Drive and SD Card - HDC-HS100K,208890876,911.96
,TomTom XL 330 S Portable GPS Sysytem - Text to Speech - 4.3' Touchscreen - 1EG0.052.01,208893644,
,SB-900 AF SPEEDLIGHT W/-STND DIFFSN DOME FLT SET - 4807,208893656,438.88
,Olympus Stylus 1050 SW 10 Megapixel Digital Camera w/ 3x optical zoom 2.7' LCD Waterproof Shockproof & Freezeproof Tap Control & Face Detection - Black - 226455,208893658,228.95
,Olympus SP-565 UZ 10 Megapixel Digital Camera w/ 20x Wide-Angle Optical Zoom Sensor-Shift Image Stabilization Face Detection & 13.5 fps Hight-Speed Sequential Shooting - 226480,208893661,
,Canon PIXMA MP480 Color Inkjet All-In-One Photo Printer - 2918B002,208893667,
,Nikon COOLPIX S60 10 Megapixel Digital Camera w/ 5x Optical Zoom Optical VR Image Stabilization 3.5' High Res Touch Panel LCD HD Pictmotion Slide Shows & Autofocus and Auto Exposure - Pink - 26132,208930714,259.88
10 Megapixel - 16:9 - 4x Optical Zoom - 4x Digital Zoom - 3' Active Matrix TFT Color LCD,Nikon Coolpix S610 Digital Camera - Midnight Black - 26125,208930717,
,Nikon COOLPIX P6000 13 Megapixels Digital Camera w/ 4x Wide Angle Optical Zoom 2.7' Hi-Res LCD Optical VR Image Stabilization Face Priority AF & TV Movies with Sound - Black - 26135,208930722,
,Nikon COOLPIX S710 14 Megapixel Digital Camera w/3.6x Optical Wide-Angle Zoom 3' LCD Smile Mode In-Camera Red-Eye Fix - Black - 26127,208930723,307.77
Cyan Magenta Yellow,Canon CL-211 Color Ink Cartridge For PIXMA MP240 and MP480 Printers - 2976B001,208937347,19.37
,Toshiba 32AV502 - 31.5' Widescreen 720p LCD HDTV w/ Cinespeed - Piano Black - 32av502u,208937533,579
,Toshiba 26AV502U - 26' Widescreen 720p LCD HDTV - Piano Black,208937534,
,TX-SR806B Receiver (7.1 Channels 130 W/Channel 0.08% THD Supports 8 Devices) - TXSR806B,208939028,622.17
,Garmin nuVi 275T - 3.5' GPS w/Text To Speech Bluetooth Where Am I? Connect Photos - 010-00576-00,208941074,245.99
,Garmin nuVi 265WT - 4.3' Widescreen GPS w/Text to Speech Bluetooth Where Am I? Connect Photos - 010-00575-10,208941075,
,Garmin 265T - 3.5' GPS w/Bluetooth Text To Speech Where Am I? Connect Photos - 010-00576-10,208941076,179.95
4.3' Active Matrix TFT Color LCD,Garmin nvi 755T Automobile Navigator - 010-00715-30,208941079,364.99
,Garmin AUTO NAV - 010-00715-20,208941080,410.95
Lithium Ion (Li-Ion) - Photo Battery,Panasonic Lithium Ion Digital Camera Battery - CGR-S006A/1B,208972043,49.99
DVD Player 5.1 Speakers - 1 Disc(s) - Progressive Scan - 450W RMS - Dolby Digital EX Dolby Pro Logic Dolby Pro Logic II,Sony BRAVIA DAV-IS50/B Home Theater System,208973561,
,iHome iH70SRC 15 Watt Computer Speakers with iPod Syncing/Charging Dock - IH70SRC,209000383,
,iHome IP47BR Bluetooth Clock Radio & Speakerphone for iPhone & iPod - iP47BR,209000385,
,Mosquito Magnet Defender Net (replacement),209002546,
,Toshiba 40RV525U - 40' Widescreen 1080p LCD HDTV w/ Cinespeed - Piano Black,209026630,710.42
,Toshiba 42RV535U - 42' Widescreen 1080p LCD HDTV w/ Cinespeed - Piano Black,209026634,789.98
,Toshiba 52RV535U - 52' Widescreen 1080p LCD HDTV w/ Cinespeed - Piano Black,209026638,
,ELECTROLUX STICK VACUUM REPLACES EL1000A,209028436,
,SAMSUNG 4GB PORTABLE MLTIMDIA PLYR BLK - YPS-S3JAB/XAA,209085175,59
,BLUEANT BLUETOOTH HS DUAL MIC NIC - 091004,209085184,99.99
,Yamaha YAS-71 Front Surround System - YAS-71BL,209114390,
Canon PowerShot SX110 IS 9 Megapixel Digital Camera w/ 10x Optical Zoom 3' LCD ISO 1600 Optical Image Stabilizer - Silver,Canon PowerShot SX110 IS Digital Camera - Silver - 2666B001,209114551,
Canon PowerShot A1000 IS 10 Megapixel Digital Camera w/ 4x Optical Zoom 2.5 LCD Optical Image Stabilizer & Face Detection - Gray,Canon PowerShot A1000 IS Digital Camera - Gray - 3210B001,209114552,
,VMware Fusion 2 - VMFM20BX2,209114575,
Black,Canon CLI-221 Black Ink Cartridge - 2946B001,209122918,11.99
Gray,Canon CLI-221 Gray Ink Cartridge - 2950B001,209122921,11.99
Yellow,Canon CLI-221 Yellow Ink Cartridge - 2949B001,209122924,11.99
Nikon D90 12 Megapixel Digital SLR Camera w/ 3' LCD Live View 18-105mm Lens 4.5 fps Burst & In-Camera Image Editing,Nikon D90 Digital SLR Camera with AF-S DX Nikkor 18-105mm f/3.5-5.6G ED VR Lens - 25448,209194240,1159.88
,Nikon D90 12 Megapixel Digital SLR Camera w/ 3' LCD Live View 4.5 fps Burst & In-Camera Image Editing - Body Only - 25446,209194241,899.95
,Canon PIXMA iP4600 Inkjet Color Photo Printer - 2909B002,209199789,
Sony VAIO VGC-JS130J/B Desktop 20.1-Inch All-in-one PC -2.5 GHz Intel Pentium Dual-Core E5200 Processor 4 GB RAM 500 GB Hard Drive Vista Premium - Black,Sony VAIO JS All-in-One Desktop - VGCJS130J/B,209208547,1028.53
,LN52A860 52' LCD TV (Widescreen 1920x1080 HDTV),209208655,2499.99
55' - ATSC NTSC - 181 Channels - 16:9 - 1920 x 1080 - Surround - HDTV - 1080p,Samsung 9 Series LN55A950 55' LCD TV,209208661,4049.98
,TiVo TCD658000 - HD XL Digital Video Recorder,209208663,544.07
,Canon PIXMA MP620 Wireless Photo All-In-One Inkjet Printer - 2921B002,209208718,
,Canon PIXMA MP980 Wireless All-in-One Color Photo Inkjet Printer - 2922B002,209208719,
Sony VAIO RT150Y All In One Desktop Computer 2.66Ghz Intel Core 2 Quad 9400 Processor 8GB RAM 1TB Hard Drive BD-RE Drive NVIDIA GeForce 9600M GT 25.5' WUXGA HD Display Windows Vista Ultimate,Sony VAIO RT All-in-One Desktop - VGCRT150Y,209245958,
Sony VAIO VGC-LV150J Desktop 24-Inch All-in-One PC - 2.53 GHz Intel Core 2 Duo E7200 Processor 4 GB RAM 500 GB Hard Drive Blu-ray Drive Windows Vista Home Premium- Silver,Sony VAIO LV All-in-One Desktop - VGCLV150J,209245960,1954.27
Sony Vaio AW Series AW110JH Notebook 2.26GHz Intel Core 2 Duo P8400 4GB RAM 320GB Hard Drive DVD +/- RW w/ Blu-ray Disc Support Wireless 802.11a/b/g/n NVIDIA GeForce 9300M 18.4' XBRITE-ECO LCD Display Webcam & Mic Windows Vista Home Premium,Sony VAIO AW110J/H Notebook - VGNAW110J/H,209245965,
,Canon VIXIA HG20 High Definition Camcorder - 3085B001AA,209253738,557.64
,Canon VIXIA HG21 High Definition Camcorder - 2704B001AA,209253739,798.97
Canon DC310 DVD Camcorder w/ 41x Advanced Zoom Built-in Lens Cover Image Stabilization & Canon Exclusive- DIGIC DV II,Canon DC310 Digital Camcorder - 2694B001,209273200,289.95
,Sony ICF-S79W Weather Band Digital Shower Radio - ICFS79W,209297152,42
DVD+RW DVD-RW DVD+R DVD-R CD-RW - DVD Video CD-DA JPEG MP3 SVCD Video CD Playback - 5 Disc(s) - Progressive Scan - Silver,Sony DVP-NC800H/S DVD Player - DVP-NC800HS,209297154,128.69
19' - ATSC NTSC - 16:9 - 1440 x 900 - Dolby - HDTV - 1080i 1080p,Sony BRAVIA M Series KDL-19M4000 19' LCD TV - kdl19m4000s,209297157,379.72
,GE GSD4000NWW Dishwasher with 5 Wash Cycles STD TUB ESTAR ( White) - gsd4000nww,209297200,313.29
,GE GSD2400NWW Dishwasher with 5 Wash Cycles - gsd2400nww,209297205,272.01
,4G Nano ToughSkin - Black - NN4-TS-BLK,209301534,18.58
Sony VAIO CS Series CS110E/R Notebook Intel Core 2 Duo T5800 2.0GHz 3GB 250GB HDD 14.1' Widescreen DVD+/-RW DL Bluetooth 802.11 a/b/g/n Microsoft Vista Home Premium (Red),Sony VAIO CS110E/R Notebook - VGNCS110E/R,209302310,965
46' - ATSC NTSC - 181 Channels - 16:9 - 1920 x 1080 - Surround - HDTV - 1080p,Samsung 9 Series LN46A950 46' LCD TV,209306028,2699.98
Dolby Digital Plus Dolby TrueHD DTS-HD THX Select 2FM AM XM,Onkyo TX-SR706 A/V Receiver - TXSR706B,209306029,595.97
Sony VAIO NS Series NS190JS Notebook 2GHz Intel Core 2 Duo T5800 4GB RAM 250GB Hard Drive DVD+/-R/RW w/ Blu Ray support Wireless Link 5100AGN Intel Graphics Media Accelerator 4500MHD 15.4' WXGA LCD Display Windows Vista Home Premium (Silver),Sony VAIO NS190J/S Notebook - VGNNS190J/S,209307663,949.99
Canon PowerShot SX10 IS 10 Megapixel Digital Camera w/ 20x Optical Zoom 28mm Wide Lens 2.5' LCD Motion Detection & Red Eye Correction,Canon PowerShot SX10 IS Digital Camera - 2665B001,209310241,339.88
Canon PowerShot SD880 IS 10 Megapixel Digital Camera w/ UA Lens 4x Optical Zoom 28mm Wide Lens Optical Image Stabilizer & PureColor II 3' LCD - Silver,Canon PowerShot SD880 IS Digital Camera - Silver - 3197B001,209310243,246.88
,Canon PowerShot SD990 IS 14 Megapixel Digital Camera w/ 3.7x Optical Zoom UA Len Face Detection 2.5 LCD & ISO 1600 - Black - 2669B001,209310245,299.88
,Canon PowerShot G10 14 Megapixel Digital Camera w/ 28mm Wide Lens 5x Optical Zoom 3' LCD Face Detection & Red Eye Correction - 2663B001,209310248,409.88
1GB Flash Memory - Pink,Apple iPod Shuffle 1GB Flash MP3 Player - MB811LL/A,209310260,49
,Nokia N96 Unlocked Phone - 16GB 5MP Camera with Carl Zeiss Optics and Dual-LED Flash and Auto-Focus Built-In GPS WiFi - 002G6Q3,209310268,
Leather - Black,Belkin Folio for iPod touch - F8Z373,209310279,19.99
Polycarbonate - Black,Griffin 8245-IP2MGNFI Clarifi Protective case for Smartphone,209393521,18.99
,Samsung LN46A860 46' LCD TV (Widescreen 1920x1080 50000:1 HDTV),209393872,1889.98
,Canon PowerShot SD990 IS 14 Megapixel Digital Camera w/ 3.7x Optical Zoom UA Len Face Detection 2.5 LCD & ISO 1600 - Silver - 3191B001,209634135,299.88
,AppleCare for iPod touch or iPod classic - MB591LL/A,209656935,49.99
Audio Player Video Player Photo Viewer - 3.5' Color LCD - 32GB Flash Memory,Apple iPod touch 32GB Flash Portable Media Player - MB533LL/A,209656949,394.99
Audio Player Video Player Photo Viewer - 2.5' Color LCD - 120GB Hard Drive - Silver,Apple iPod Classic 120GB Hard Drive Portable Media Player - MB562LL/A,209656950,219.97
,Apple 8GB iPod nano Silver (4th Generation) - MB598LL/A,209656951,146.75
,Apple 8GB iPod nano Blue (4th Generation) - MB732LL/A,209656955,146.75
,Apple 8GB iPod nano Pink (4th Generation) - MB735LL/A,209656956,146.75
,Apple 8GB iPod nano Purple (4th Generation) - MB739LL/A,209656957,146.75
,Apple 8GB iPod nano Green (4th Generation) - MB745LL/A,209656959,139.88
Audio Player Video Player Photo Viewer - 2.5' Color LCD - 120GB Hard Drive - Black,Apple iPod Classic 120GB Hard Drive Portable Media Player - MB565LL/A,209656961,219.97
,Apple 8GB iPod nano Black (4th Generation) - MB754LL/A,209656962,146.75
Audio Player Video Player Photo Viewer - 2' Color LCD - 16GB Flash Memory - Green,Apple iPod nano 16GB Flash Portable Media Player - MB913LL/A,209656971,178.99
Panasonic DMC-FZ28K Lumix 10 Megapixel Digital Camera with 27mm LEICA DC VARIO-ELMARIT Lens 18x Optical Zoom and Intelligent Auto Mode - Black,Panasonic Lumix DMC-FZ28 Digital Camera - Black,209687172,
,USB POWER ADAPTER ACCS - MB352LL/B,209700735,
1 x USB - 1 x USB - 8ft - White,Belkin Switch-to-Mac Cable - F4U001,209704118,21.8
Audio Player Video Player Photo Viewer - 3.5' Color LCD - 8GB Flash Memory,Apple iPod touch 8GB Flash Portable Media Player - MB528LLA,209705773,229
Audio Player Video Player Photo Viewer - 3.5' Color LCD - 16GB Flash Memory,Apple iPod touch 16GB Flash Portable Media Player - MB531LLA,209705774,309.99
,Canon EOS 50D 15 Megapixel SLR Digital Camera with Live View & Face Detection 3' LCD 6.3fps & DIGIC 4 Image Processor - Body Only - 2807B006,209705777,1127.95
,Canon EOS 50D 15 Megapixel SLR Digital Camera w/28-135MM IS USM Lens Live View & Face Detection 3' LCD 6.3fps DIGIC 4 Image Processor & HDMI output - 2807B005,209705778,1301.30
15' - Active Matrix TFT - ATSC NTSC - 16:9 - 1280 x 800 - HDTV,Coby Electronics TF-TV1514 15' LCD TV,209720586,149.99
,LG 42PG20 - 42' Widescreen 720p Plasma HDTV - 20000:1 Dynamic Contrast Ratio,209869342,
,SONY 42IN BRAVIA LCD V-SERIES 1080P HDTV - KDL42V4100,209869989,1098.72
Photo Viewer - 8' LCD,Sony DPFD80 Digital Photo Frame,209871973,
,Transcend 2.5 Solid State Disk (SSD) 128GB SATA MLC with Build-In ECC - TS128GSSD25S-M,209890560,
,VholdR 2200 Mount Adhesive (Black),209890796,
Dolby Pro Logic IIx Dolby Digital EX DTS-ES Discrete DTS-ES Matrix DTS Neo:6 Dolby TrueHD Dolby Digital Plus Neural SurroundAM FM,Denon AVR2809CI A/V Receiver,209891039,1198.00
,TH-58PZ850U 58' Plasma TV (Widescreen 1920x1080 30000:1 HDTV) - TH58PZ850U,209891040,2999.97
,MOTOROLA T305 BLUETOOTH VISOR SPEAKER PHONE CAR KIT - RETAIL - 89082J,209896109,46.93
,Aliph Jawbone 2 Silver Bluetooth Headset - Retail - 84442VRP,209896693,89.99
,Sony VAIO CS Series VGN-CS180J/W 14.1-Inch Notebook 2.26 GHz Intel Core 2 Duo P8400 Processor 4 GB RAM 320 GB Hard Drive Blu-ray Drive Vista Home Premium- White - VGNCS180J/W,209901963,1219.00
