description,name,entityUrl,price
DVD+RW DVD-RW BD-RE CD-RW xD-Picture Card CompactFlash (CF) Secure Digital (SD) Mini Secure Digital (miniSD) Memory Stick Memory Stick Duo Memory Stick PRO - BD Video DVD Video JPEG MP3 CD-DA MPE,Sony HESV1000 Blu-ray Player/Recorder,207390502,
,Denon S32 Network Ready Table-Top Stereo System - Deno_S-3289349,207390506,360.99
BD-R DVD-RW CD-RW Secure Digital (SD) Mini Secure Digital (miniSD) - BD Video DVD Video CD-DA MP3 WMA JPEG DivX 6 LPCM Playback - Progressive Scan,Denon DVD-2500BTCI Blu-ray Disc Player,207390507,655.97
16:9 - 2x Digital Zoom - 2.5' Active Matrix TFT Color LCD,Sony Cyber-shot DSC-W120 Digital Camera - Pink - DSCW120/P,207390617,109.99
10.1 Megapixel - 16:9 - 2x Digital Zoom - 3.5' Active Matrix TFT Color LCD,Sony Cyber-shot DSC-T300 Digital Camera - Black - DSCT300/B,207390618,273.95
52' - Active Matrix TFT - ATSC NTSC - 16:9 - 1920 x 1080 - HDTV,Sharp AQUOS LC-52SE94U 52' LCD TV,207390641,2049.99
16:9 - 2.5' Color LCD,Sony Handycam DCR-HC52 Digital Camcorder - DCRHC52,207390644,229
16:9 - 2.7' Hybrid LCD,Sony Handycam DCR-SR45 Digital Camcorder - DCRSR45,207390650,304.99
16:9 - 2.7' Hybrid LCD,Sony Handycam DCR-SR85 Digital Camcorder - DCRSR85,207390652,375.8
16:9 - 2.7' Hybrid LCD,Sony Handycam HDR-SR10 High Definition Digital Camcorder - HDRSR10,207390654,549
16:9 - 3.2' Color LCD,Sony Handycam HDR-SR12 High Definition Digital Camcorder - HDRSR12,207390655,869
16:9 - 2.7' Color LCD,Sony Handycam HDR-HC9 High Definition Digital Camcorder - HDRHC9,207390656,824.95
10.2 Megapixel - 2.7' Active Matrix TFT Color LCD,Sony alpha DSLR-A200 Digital SLR Camera with Dual Lens Kit - DSLRA200W,207390665,699
Lithium Ion (Li-Ion) - Photo Battery,Canon BP-808 Lithium Ion Camcorder Battery Pack - 2740B002,207390671,51.84
Panasonic Lumix DMC-TZ5K 9 Megapixel Digital Camera with 28mm Wide-Angle Lens 10x Optical Zoom 3' LCD and HD Output - Black,Panasonic Lumix DMC-TZ5 Digital Camera - Black,207390673,
Nylon Polyamide - Black,Sony LCS-X20 Camcorder Case - LCSX20,207390682,
10.2 Megapixel - 3.9x Optical Zoom - 2.7' Active Matrix TFT Color LCD,Sony alpha DSLR-A300 Digital SLR Camera with 18-70mm Zoom Lens - Black - DSLRA300K,207390706,599
14.2 Megapixel - 16:9 - 2.7' Active Matrix TFT Color LCD,Sony alpha DSLR-A350 Digital SLR Camera - DSLRA350,207390709,594.73
14.2 Megapixel - 3.9x Optical Zoom - 2.7' Active Matrix TFT Color LCD,Sony alpha DSLR-A350K Digital SLR Camera with 18-70mm Zoom Lens - Black - DSLRA350K,207390710,686.24
37' - Active Matrix TFT - NTSC ATSC - 16:9 - 1920 x 1080 - HDTV,Sharp AQUOS LC-37D64U 37' LCD TV,207390717,880.72
,Toshiba 22LV505 - 22' Widescreen LCD HDTV w/ Built-in DVD Player - 1000:1 Contrast Ratio - 5ms Response Time - Black,207391013,
,Toshiba 19LV506 - 19' Widescreen LCD HDTV w/ Built-in DVD Player - 800:1 Contrast Ratio - 5ms Response Time - White,207391014,
,Toshiba 19LV505 - 19' Widescreen LCD HDTV w/ Built-in DVD Player - 800:1 Contrast Ratio - 5ms Response Time,207391015,
Toshiba SD-P101S - 10.2' Portable DVD Player - DiVx Compatible,Toshiba SD-P101S Portable DVD Player - SDP101S,207391017,
8.5' LCD - DVD+RW DVD-RW DVD-RAM DVD+R DVD-R CD-RW - DVD Video CD-DA MP3 JPEG MPEG-4 DivX WMA Video CD SVCD HighMAT Playback,Panasonic DVD-LS83 Portable DVD Player,207391018,148.69
8.5' LCD - DVD+RW DVD-RW DVD-RAM DVD-R DVD+R CD-RW - CD-DA MP3 WMA JPEG MPEG-4 DivX Video CD SVCD HighMAT DVD Video Playback,Panasonic DVD-LS86 Portable DVD Player,207391019,164.12
DVD+RW DVD-RW DVD-RAM DVD-R DVD+R CD-RW Secure Digital (SD) - DVD Video CD-DA MP3 JPEG DivX MPEG-2 PCM Playback - Progressive Scan - 14.33Hour Recording,Panasonic DMR-EA18K DVD Player/Recorder,207391020,
DVD+RW DVD-RW DVD-RAM DVD+R DVD-R CD-RW Secure Digital (SD) - DVD Video CD-DA MP3 JPEG DivX PCM MPEG-2 Playback - Progressive Scan - 14.33Hour Recording,Panasonic DMR-EZ28K DVD Player/Recorder,207391021,
DVD+RW DVD-RW DVD-RAM DVD-R DVD+R CD-RW VHS Secure Digital (SD) Card - DVD Video CD-DA MP3 JPEG DivX SQPB MPEG-2 PCM Playback - Progressive Scan - 14.33Hour Recording,Panasonic DMR-EA38VK DVD/VCR Combo,207391022,
DVD+RW DVD-RW DVD-RAM DVD+R DVD-R CD-RW VHS Secure Digital (SD) Card - DVD Video CD-DA MP3 JPEG DivX SQPB PCM MPEG-2 Playback - Progressive Scan - 14.33Hour Recording,Panasonic DMR-EZ48VK DVD/VCR Combo,207391023,
Toshiba 19AV500U - 19' 720p LCD HDTV w/ Built-in NTSC/ATSC Tuner - Piano Black,Toshiba 19AV500U 19' LCD TV,207391431,
Toshiba 22AV500U - 22' 720p LCD HDTV w/ Built-in NTSC/ATSC Tuner - Piano Black,Toshiba 22AV500U 22' LCD TV,207391434,338.99
2-way Speaker - Cable - White,Yamaha Outdoor NS-AW390 All-Weather Speaker System - NS-AW390WH,207464919,79.96
2-way Speaker - Cable - Black,Yamaha Outdoor NS-AW390 All-Weather Speaker System - NS-AW390BL,207464920,78.89
2-way Speaker - Cable - Black,Yamaha NS-AW190 All-Weather Speaker System - NS-AW190BL,207464921,51.72
Samsung NV30 8 Megapixel Digital Camera with Schneider Lens Dual Image Stabilization Smart Touch and Face Detection - Silver,Samsung NV30 Digital Camera - Silver - EC-NV30ZSBA/US,207464939,139
Panasonic Lumix DMC-TZ5S 9 Megapixel Digital Camera with 28mm Wide-Angle Lens 10x Optical Zoom 3' LCD and HD Output - Silver,Panasonic Lumix DMC-TZ5 Digital Camera - Silver,207465587,
Panasonic DMC-FS3S 8 Megapixel Compact Digital Camera with 33mm Lens 3x Optical Zoom Intelligent Auto Mode and 2.5' Diagonal Intelligent LCD - Silver,Panasonic Lumix DMC-FS3 Digital Camera - Silver,207465595,137.33
4 x USB 1 x Network 1 x VGA 1 x DVI-D 1 x Microphone 1 x Headphone 1 x DC-in,Sony VAIO USB Docking Station - VGPUPR1,207469300,142.95
Nikon D60 10 Megapixel Digital SLR Camera with AF-S DX Nikkor 18-55mm f/3.5-5.6G VR Lens - 3x Optical Zoom - 2.5' Active Matrix TFT Color LCD,Nikon D60 Digital SLR Camera with AF-S DX Nikkor 18-55mm f/3.5-5.6G VR Lens - 25438,207502093,
26' - ATSC NTSC - 16:9 - 1366 x 768 - HDTV,Panasonic VIERA TC-26LX85 26' LCD TV,207506250,547.92
32' - 16:9 - 1920 x 1080,Panasonic VIERA TC-32LZ800 32' LCD TV,207506251,
37' - ATSC NTSC - 16:9 - 1920 x 1080 - HDTV,Panasonic VIERA TC-37LZ85 37' LCD TV,207506253,799.11
,Altec Lansing Orbit-MP3 Portable Audio System - IM207,207509842,
25 lb - Black,Peerless PP730 Universal Pivot Wall Arm,207514417,
Nylon - Black,Sony LCS-MX100 Camcorder Case - LCSMX100,207514563,32.78
Nylon Polyester,Sony Camcorder Case - LCSX30,207514566,
Floor Standing Tripod - 18.9' to 57.6' Height - 6.6 lb Load Capacity,Sony VCT-60AV Tripod - VCT60AV,207514567,69.95
Floor Standing Tripod - 24.8' to 65.75' Height - 8.8 lb Load Capacity,Sony VCT-80AV Tripod - VCT80AV,207514568,
Panasonic DMC-FS3A 8 Megapixel Compact Digital Camera with 33mm Lens 3x Optical Zoom Intelligent Auto Mode and 2.5' Diagonal Intelligent LCD - Blue,Panasonic Lumix DMC-FS3 Digital Camera - Blue,207527632,
,KENWOOD KCA-SR50 SIRIUS Radio Translator for In-Dash Head Units,207533462,42.36
16 GB,Sony 16GB Memory Stick PRO Duo Card (Mark 2) - MSMT16G,207534895,110.99
Garmin nuvi 205 Automobile Navigator - 3.5' Active Matrix TFT Color LCD,Garmin nvi 205 Automobile Navigator - 010-00717-40,207535170,
,Lasonic LTA-260 ATSC Converter Box,207535265,
Garmin nuvi 255W 4.3' GPS w/ Text To Speech Where Am I?,Garmin nvi 255W Automobile Navigator - 010-00718-20,207536225,204.99
Garmin nuvi 205W Portable GPS System w/ Preloaded Maps,Garmin nvi 205W Automobile Navigator - 010-00718-40,207536226,162.99
1 x Phone Line(s) - Black,Panasonic KX-TG4321B 5.8 GHz Expandable Digital Cordless Phone,207538225,
Samsung L200 10 Megapixel Digital Camera with 2.5 LCD 3x Optical Zoom Digital Image Stabilization Face Detection Function - Black,Samsung L200 Digital Camera - Black - EC-L200ZBBA/US,207539418,119
,Sony Mylo COM-2 PDA (1GB Memory Stick Duo) Personal Communicator - COM2WHITE,207540310,197.88
8.1 Megapixel - 16:9 - 2x Digital Zoom - 3' Active Matrix TFT Color LCD,Sony Cyber-shot DSC-H10 Digital Camera - Black - DSCH10/B,207542597,213.72
16:9 - 2x Digital Zoom - 2.5' Active Matrix TFT Color LCD,Sony Cyber-shot DSC-W120 Digital Camera - Silver - DSCW120,207542598,106.42
,Sony DSC-750 Cyber-shot Digital Camera - DSC750,207542599,99.72
1 x Phone Line(s) - Black,Panasonic KX-TG9361B Expandable Digital Cordless Phone,207543188,45.04
1 x Phone Line(s) - Black,Panasonic KX-TG9372B Expandable Digital Cordless Phone,207543189,86.54
1 x Phone Line(s),Panasonic KX-TG9344T Expandable Digital Cordless Phone,207543190,116.21
Panasonic KX-TG9343T DECT 6.0 Expandable Digital Cordless Answering System w/3 Handsets,Panasonic KX-TG9343T Cordless Phone,207543191,102.12
1 x Phone Line(s) - Black Metallic,Panasonic KX-TG9342T Cordless Phone,207543192,
1 x Phone Line(s) - Black Metallic,Panasonic KX-TG9341T Cordless Phone,207543193,
1 x Phone Line(s) - Silver,Panasonic KX-TG9332S DECT 6.0 Expandable Digital Cordless Phone,207543196,
Panasonic DECT 6.0 1.9GHz Expandable Cordless Phone with Digital Answering System,Panasonic KX-TG9333T Cordless Phone - KX-TG9333T,207543197,
1 x Phone Line(s) - Black Metallic,Panasonic KX-TG9332T Cordless Phone,207543198,
1 x Phone Line(s) - Metallic Black,Panasonic KX-TG9348T Expandable Digital Cordless Phone,207543201,
,DNX5120 All-in-One Navigation/DVD Entertainment System,207544265,635
,ONKYO 6-DISC CD CHANGER W/VLSC BLACK NIC - DX-C390,207544306,179.72
Olympus EVOLT E-420 10 Megapixel Digital SLR Camera with 14-42MM Outfit Autofocus Live View Face Detection & Dust Reduction,Olympus EVOLT E-420 Digital SLR Camera With 14 - 42mm f/3.5-f/5.6 Zuiko Digital Zoom Lens - Black - 262081,207552185,403.72
1TB - Type A USB,Apple Time Capsule Network Hard Drive - MB277LL/A,207554111,439
Samsung LN46A650 - 46' 1080p LCD HDTV - 50000:1 Dynamic Contrast Ratio - 120Hz - 4ms Response Time,Samsung LN46A650 46' LCD TV,207595882,1599.98
Samsung LN40A550 - 40' Widescreen 1080p LCD HDTV - 30000:1 Dynamic Contrast Ratio - 5ms Response Time - Piano Black,Samsung LN40A550 40' LCD TV,207637777,910.99
Panasonic SDR-H60 60GB Hard Disk Drive/SD Hybrid Camcorder with 50x Optical Zoom Advanced Optical Image Stabilization One-Touch DVD Copy Anti-Shock Shield and One-Touch Navigation Records to Internal Hard Drive or SD Card,Panasonic Palmcorder SDR-H60 Digital Camcorder - SDR-H60S,207637793,
Samsung LN52A650 - 52' 1080p LCD HDTV - 50000:1 Dynamic Contrast Ratio - 120Hz - 4ms Response Time,Samsung LN52A650 52' LCD TV,207642166,1895.00
DVD Player 5.1 Speakers - 5 Disc(s) - Progressive Scan - 1200W RMS - Dolby Digital Dolby Pro Logic II DTS,Samsung HT-Z510 Home Theater System,207642355,321.55
Samsung PN50A450 - 50' Widescreen 720p Plasma HDTV - 1000000:1 Dynamic Contrast Ratio - Piano Black,Samsung PN50A450 50' Plasma TV,207642358,995
,Samsung DVD-VR375 DVD/VCR Combo - DVD+RW DVD-RW DVD-RAM DVD+R DVD-R VHS CD-RW - DVD Video CD-DA MP3 MPEG-4 WMA JPEG DivX Playback - Progressive Scan,207642497,154.64
Canon PowerShot SD790 IS 10 Megapixel Digital Camera with 3x Optical Zoom 3' LCD & PictBridge,Canon PowerShot SD790 IS Digital Camera - 2554B001,207643190,
Canon PowerShot SD890 IS 10 Megapixel 5x Optical Zoom 2.5' LCD UA Lens Digital Camera,Canon PowerShot SD890 IS Digital Camera - 2566B001,207643194,198
55mm to 250mm - f/4 to 5.6,Canon EF-S 55-250mm f/4-5.6 IS Telephoto Zoom Lens - 2044B002,207645242,232.98
,SAMSUNG DVD HM THEATER SYS 5 DISC NIC - HT-Z410/XAA,207652053,235.14
,Samsung LN52A550 - 52' Widescreen 1080p LCD HDTV - 30000:1 Dynamic Contrast Ratio - 5ms Response Time - Piano Black,207652055,1579.00
Samsung LN46A550 - 46' Widescreen 1080p LCD HDTV - 30000:1 Dynamic Contrast Ratio - 5ms Response Time - Piano Black,Samsung LN46A550 46' LCD TV,207652056,1143.99
,OmniMount Stellar G303 Series 3 Shelf Component Stand - Black - G303 DARK,207653535,299.95
Samsung PN58A550 - 58' Widescreen 1080p Plasma HDTV - 1000000:1 Dynamic Contrast Ratio - Piano Black,Samsung PN58A550 58' Plasma TV,207653548,2294.90
Canon EOS Rebel XSi 12 Megapixel Digital SLR Camera with 18-55mm IS Lens - Silver,Canon EOS Rebel XSi Digital SLR Camera with EF-S 18-55mm f/3.5-5.6 IS Lens - Silver - 2757B003,207654105,649.88
Canon EOS Rebel XSi 12 Megapixel Digital SLR Camera with 18-55mm IS Lens - Black,Canon EOS Rebel XSi Digital SLR Camera with EF-S 18-55mm f/3.5-5.6 IS Lens - Black - 2756B003,207654106,649.88
Samsung LN37A450 - 37' Widescreen 720p LCD HDTV - 10000:1 Dynamic Contrast Ratio - 6ms Response Time - Piano Black,Samsung 4 Series LN37A450 37' LCD TV,207656388,796.82
Toshiba SD-P71S - 7' Portable DVD Player,Toshiba SD-P71S Portable DVD Player,207659192,119.36
Toshiba SD-P91S - 9' Portable DVD Player,Toshiba SD-P91S Portable DVD Player,207659194,164.72
Samsung LN40A650 - 40' 1080p LCD HDTV - 50000:1 Dynamic Contrast Ratio - 120Hz - 4ms Response Time,Samsung LN40A650 40' LCD TV,207660497,1279.98
Samsung LN37A550 - 37' Widescreen 1080p LCD HDTV - 15000:1 Dynamic Contrast Ratio - 5ms Response Time - Piano Black,Samsung 5 Series LN37A550 37' LCD TV,207660498,944
Samsung PN50A550 - 50' Widescreen 1080p Plasma HDTV - 1000000:1 Dynamic Contrast Ratio - Piano Black,Samsung PN50A550 50' Plasma TV,207660499,1499.98
8 GB,Sony 8GB Memory Stick PRO Duo Card - MSMT8G,207666379,49.85
1 GB,Sony 1GB Memory Stick PRO Duo Card - MSMT1G,207666380,13.41
4 GB,Sony 4GB Memory Stick PRO Duo Card - MSMT4G,207666381,26.92
2 GB,Sony 2GB Memory Stick PRO Duo Card - MSMT2G,207666382,15.99
665W - Dolby TrueHD Dolby Digital EX Dolby Pro Logic IIx Dolby Digital Plus DTS-HD DTS-ES DTS 96/24 DTS Neo:6 Neural SurroundXM,Yamaha RX-V663 Home Theater Receiver - RXV663BL,207667994,499
,Handycam HDR-UX10 DVD Camcorder (15x Opt 180x Dig 2.7' LCD) - HDRUX10,207667995,768.24
Samsung LN32A450 - 32' Widescreen 720p LCD HDTV - 10000:1 Dynamic Contrast Ratio - 6ms Response Time - Piano Black,Samsung 4 Series LN32A450 32' LCD TV,207679756,578
Plastic - Pink,Speck Products SeeThru Case for Apple MacBook Air - MBA-PNK-SEE,207682339,
Plastic - Clear,Speck Products SeeThru Case for Apple MacBook Air - MBA-CLR-SEE,207682340,
Laser,Logitech V450 Nano Cordless Laser Mouse For Notebooks - 910-000619,207682397,
Black,TOMTOM ONE 130 Carry Bag - 9UEA.017.00,207686035,14.74
Samsung LN26A450 - 26' Widescreen 720p LCD HDTV - 5000:1 Dynamic Contrast Ratio - 8ms Response Time - Piano Black,Samsung 4 Series LN26A450 26' LCD TV,207686156,549
10.2' - Active Matrix TFT - ATSC NTSC - 16:9 - 800 x 480 - HDTV,Coby Electronics TF-TV1022 10.2' LCD TV - TFTV1022,207686317,119.99
Laser,Logitech V470 Cordless Laser Mouse for Notebooks - 910-000692,207875395,
,Panasonic Viera TH-50PZ800U - 50' Widescreen 1080p Plasma HDTV - 1000000:1 Dynamic Contrast Ratio,207876534,1711.19
735W - Dolby TrueHD Dolby Digital EX Dolby Pro Logic IIx Dolby Digital Plus DTS-HD DTS-ES DTS 96/24 DTS Neo:6 Neural SurroundXM,Yamaha RX-V863 Home Theater Receiver - RXV863BL,207876535,649.99
,TomTom ONE 130 S Portable GPS System w/ Preloaded Maps - 1EE0.052.02,207895085,
Samsung LN22A451 - 22' Widescreen LCD HDTV - 3000:1 Dynamic Contrast Ratio - 8ms Response Time - White,Samsung 4 Series LN22A451 22' LCD TV,207897315,399
Sharp LC-26DV24U - 26' Widescreen TV/DVD Combo HDTV - 800:1 Contrast Ratio - 8ms Response Time - Piano Black,Sharp LC26DV24U 26' TV/DVD Combo,207897840,508.72
175 lb - Black,Sanus VisionMount LT25-B1 Tilting Wall Mount,207899810,
,Wal-mt Furn Comp Shlf - VF2012-B1,207899814,
Samsung HL56A650 - 56' Widescreen 1080p DLP HDTV w/ Built in NTSC/ATSC Tuner - Piano Black,Samsung 6 Series HL56A650 56' Projection TV,207900170,1079.96
Samsung HL61A650 - 61' Widescreen 1080p DLP HDTV w/ Built in NTSC/ATSC Tuner - Piano Black,Samsung 6 Series HL61A650 61' Projection TV,207900171,1076.94
Samsung LN19A450 - 19' Widescreen 720p LCD HDTV - 3000:1 Dynamic Contrast Ratio - 8ms Response Time - Piano Black,Samsung LN19A450 19' LCD TV,207900175,348
Samsung LN19A650 - 19' Widescreen LCD HDTV - 3000:1 Dynamic Contrast Ratio - 8ms Response Time,Samsung 6 Series LN19A650 19' LCD TV,207900176,369
Samsung LN22A450 - 22' Widescreen 720p LCD HDTV - 3000:1 Dynamic Contrast Ratio - 8ms Response Time - Piano Black,Samsung 4 Series LN22A450 22' LCD TV,207900177,397.77
Samsung LN22A650 - 22' Widescreen LCD HDTV - 3000:1 Contrast Ratio - 8ms Response Time,Samsung LN22A650 22' LCD TV,207900178,458
Samsung LN32A550 - 32' Widescreen 1080p LCD HDTV - 15000:1 Dynamic Contrast Ratio - 5ms Response Time - Piano Black,Samsung LN32A550 32' LCD TV,207900179,849
,Samsung PN42A450 - 42' Widescreen 720p Plasma HDTV - 100000:1 Dynamic Contrast Ratio - Piano Black - PN42A450P,207900180,899.99
SAMSUNG 5 DVD HM THEATER WI-FI XM READY NIC,Samsung HT-TZ515 Home Theater System - HTZ515/XAA,207900343,
Wood - Black,Techcraft ABS60 TV Stand,207907430,
,Sport Neckband Earbuds - MDR AS50G,207907535,32.71
,Bass Lover Earbuds Slver - MDRED12LP/SLV,207907548,10.99
,Ex Series Earbuds Black - MDR EX32LP/BLK,207907550,15.65
,Bass Lover Earbuds Red - MDRED12LP/RED,207907552,10.99
,Ex Series Earbuds Wht - MDR EX55/WHI,207907555,25.76
,Ex Series Earbuds Pnk - MDR EX55/PNK,207907557,23.58
,Ex Series Earbuds Wht - MDR EX32LP/WHI,207907558,16.99
,Ex Series Earbuds Black - MDR EX55/BLK,207907559,22.2
8' LCD - DVD+RW DVD-RW DVD+R DVD-R CD-RW - DVD Video CD-DA MP3 JPEG Playback - 1 Disc(s) - Black,Sony DVP-FX820 Portable DVD Player - DVPFX820,207910212,158.72
Belt Drive,Sony PSLX300USB USB Record Turntable,207910213,119.72
500W - Dolby Digital Dolby Pro Logic II DTS,Yamaha RX-V363 Home Theater Receiver - RXV363BL,207910214,199
Laser - 4 x Button,Apple Wireless Mighty Mouse - MB111LL/A,207910337,69
,DENON PRO 5 CD CAROUSEL CHANGER NIC - DCM290P,207910387,
Samsung LN46A750 - 46' 1080p LCD HDTV - 50000:1 Dynamic Contrast Ratio - 6ms Response Time - 120Hz,Samsung 7 Series LN46A750 46' LCD TV - LN46A750R1FXZA,207919773,1537.77
Ear-bud,Griffin TuneBuds Stereo Earset - 9410-TUNBMBLB,207920831,19.53
DVD Player 5.1 Speakers - 5 Disc(s) - Progressive Scan - 1000W RMS - Dolby Digital DTS Dolby Pro Logic,Panasonic SC-PT660 Home Theater System,207925431,
Panasonic SC-PT760 Premium Sound DVD Home Theater System with Kelton Subwoofer,Panasonic SC-PT760 Home Theater System,207925432,319.97
30',Griffin SmartTalk Headphone Adapter with Control and Mic for iPhone - 3016-SMRTLKB,207925440,
Samsung LN32A650 - 32' 1080p LCD HDTV - 50000:1 Dynamic Contrast Ratio - 4ms Response Time,Samsung 6 Series LN32A650 32' LCD TV,207927557,916.13
,TomTom XL 330 Portable GPS System w/ Preloaded Maps - 1EG0.052.00,207929461,
Dolby Digital Dolby Pro Logic II Digital Cinema Sound DTS,Sony STR-DG520 A/V Receiver - STRDG520,207934190,164.51
Dolby Digital Dolby Pro Logic II DTS 96/24 DTS Neo:6 Dolby Digital EX Dolby Pro Logic IIx Dolby Pro Logic DTS-ES Digital Cinema Sound DTS,Sony STR-DG720 A/V Receiver - STRDG720,207934191,224.79
DVD-RW DVD+RW DVD-R DVD+R CD-RW - DVD Video CD-DA MP3 JPEG SVCD Video CD Playback - 1 Disc(s) - Progressive Scan - Black,Sony DVP-NS700H/B DVD Player,207934192,
1 x Phone Line(s) - Silver,Panasonic KX-TG6313S Cordless Phone,207935920,
DVD+RW DVD-RW CD-RW - DVD Video JPEG MP3 WMA MPEG-4 DVD Audio Video CD CD-DA DivX Playback - Progressive Scan,Samsung DVD-1080P8 DVD Player,207936135,72.11
,Sharp Air Purifier 194 CFM Max - KC-C100U,207937885,
Nikon COOLPIX P80 10 Megapixel Digital Camera with 18x Optical Wide-Angle Zoom 2.7' High-Resolution LCD Vibration Reduction Image Stabiliation & up to an ISO6400,Nikon Coolpix P80 Digital Camera - 26114,207937987,271.72
,Samsung LN40A750 - 40' 1080p LCD HDTV - 50000:1 Dynamic Contrast Ratio - 4ms Response Time - 120Hz,207938488,1341.12
OmniMount Echo 50 Moda Collection TV Table Stand for up to 50' TVs - Espresso,OmniMount Moda Collection Echo 50 TV Stand - ECHO 50,207945552,
Dolby Digital Dolby Pro Logic IIx Dolby Digital EX DTS DTS-ES DTS 96/24 DTS Neo:6FM AM,Onkyo TXSR506 A/V Receiver,207959750,227.72
,Samsung LN52A750 - 52' 1080P LCD HDTV - 50000:1 Dynamic Contrast Ratio - 120Hz - 6ms Response Time,207959798,2148.99
9.1 Megapixel - 16:9 - 2x Digital Zoom - 3' Active Matrix TFT Color LCD,Sony Cyber-shot DSC-H50 Digital Camera - Black - DSCH50B,207959814,329
Samsung SC-D382 Mini DV Camcorder,Samsung SC-D382 Digital Camcorder,207965387,128.96
Samsung HT-X810 2.1 Soundbar Home Theater System,Samsung HTX810T Home Theater System - HTX810T,207978102,580.14
,Kensington Mini Battery Pack and Charger for iPhone and iPod - K33442US,207979206,
,Samsung DVD-V9800 DVD/VCR Combo Player w/ 1080p Up-Conversion,207986331,85.06
,Boston Acoustics Horizon Solo AM/FM Radio - HSOLOMNDT,207993409,90
CD-R CD-RW - CD-DA MP3 WMA AAC - 4 - 200W - FM AM,ALPINE CDA-9887 Car Audio Player - CDA9887,208033486,295
CD-RW - CD-Text MP3 WMA WAV AAC - 4 - 200W - FM AM,Pioneer DEHP400UB Car Audio Player,208033806,134.32
CD-RW - CD-Text MP3 WMA WAV AAC - 4 - 200W - FM AM,Pioneer DEH-P3000IB Car Audio Player,208033808,92.72
 5.1 Speakers - Progressive Scan - 600W RMS - Black,Yamaha YHT-390BL Home Theater System - YHT-390bl,208033955,319.96
Metal Glass - Black Chrome,Z-Line Designs ZL23-44MU Portland Flat Panel TV Stand with Integrated Mount,208042911,254.37
,Samsung HL-67A750 - 67' Widescreen 1080p DLP HDTV - 10000:1 Contrast Ratio - HL67A750,208042977,1729.98
,Nintendo DS Lite (Metallic Rose) - USGSZPB,208043057,
,Samsung PN50A650 50' 1080p Plasma HDTV - 1000000:1 Dynamic Contrast Ratio - Anti Burn-in Technology,208079230,1699.98
Pioneer KURO PDP-5020FD - 50' 1080p Plasma HDTV,Pioneer PDP-5020FD 50' Plasma TV,208084021,2199.98
1 x Proprietary - 1 x Type A USB 3 x RCA,Pioneer Direct Control Cable - CD-IU230V,208085175,41.44
,Pioneer Cd-sb10 Sirius Interface Cable - CD-SB10,208085178,
CD-RW - CD-Text MP3 WMA WAV - LCD - 4 - 200W - FM AM,Pioneer DEH-2000MP Car Audio Player,208085180,84
,Pioneer GEX-P10HD HD Radio Add-on Tuner for Select In-dash Pioneer Receivers,208085182,
Pioneer KURO PDP-6020FD - 60' 1080p Plasma HDTV,Pioneer PDP-6020FD 60' Plasma TV,208085253,
DVD+RW DVD-RW DVD+R DVD-R CD-RW - DVD Video CD-DA MP3 JPEG SVCD Video CD Playback - 5 Disc(s) - Progressive Scan - Black,Sony DVP-NC800H/B DVD Player,208105467,
4 Channel(s) - Class AB - 100dB SNR,ALPINE MRP-F300 Car Amplifier,208105573,
CD-RW - CD-Text MP3 WMA WAV AAC - 4 - 200W - FM AM,Pioneer DEHP500UB Car Audio Player,208105630,153.64
,CORDED TELEPHONE - KEYPAD - SINGLE LINE OPERATION - LCD DISPLAY - CALLER ID; CAL - KX-TS620W,208111279,
,CORDED TELEPHONE - KEYPAD - SINGLE-LINE OPERATION - 2-WAY - LCD DISPLAY - BLACK - KX-TS620B,208111280,
BD Player 5.1 Speakers - 1 Disc(s) - Progressive Scan - 1250W RMS - Dolby Digital Dolby TrueHD Dolby Digital Plus DTS-HD DTS,Panasonic SC-BT100 Home Theater System - SC-BT100P-K,208111903,
Panasonic SC-PT960 5-Disc DVD Home Theater System with Kelton Subwoofer 1080p Up-Conversion Integrated Universal Dock for iPod 2 Tower Speakers Wireless Rear Speaker and VIERA Link,Panasonic SC-PT960 Home Theater System,208111904,349.99
 5.1 Speakers - 5 Disc(s) - Progressive Scan - 1000W RMS - Dolby Pro Logic II,Sony BRAVIA DAV-HDX275 Home Theater System,208112354,
DVD Player 6.1 Speakers - 5 Disc(s) - Progressive Scan - Dolby Digital DTS Dolby Pro Logic II - Black,Sony BRAVIA DAV-HDX279WC Home Theater System,208112355,318.01
8' LCD - DVD+R DVD+RW DVD-RW DVD-R CD-RW - JPEG MP3 DVD Video Playback - 1 Disc(s) - Blue,Sony DVP-FX820/L Portable DVD Player - DVPFX820/L,208112356,131.54
8' LCD - DVD+RW DVD-RW DVD+R DVD-R CD-RW - DVD Video CD-DA MP3 JPEG Playback - 1 Disc(s) - Red,Sony DVP-FX820/R Portable DVD Player - DVPFX820/R,208112357,159.94
DVD+RW DVD-RW DVD+R DVD-R CD-RW - DVD Video CD-DA MP3 JPEG SVCD Video CD Playback - 1 Disc(s) - Progressive Scan - Silver,Sony DVP-NS700H/S DVD Player - DVPNS700HS,208112358,111.68
,LG 22 Cu.Ft. Total Capacity,208114664,
,LG 22.6 Cu.Ft. Total Capacity,208114670,
,LG 25.0 Cu.Ft. Total Capacity,208114672,
,LG 25.0 Cu.Ft. Total Capacity,208114673,
,LG 25.0 Cu.Ft. Total Capacity,208114674,
,LG 25.0 Cu.Ft. Total Capacity,208114675,
,LG 25 Cu. Ft. Ice & Water Dispensing,208114681,
,LG 24.7 cu. ft. Stainless Steel French Door Bottom Mount Refrigerator,208114682,
,LG 25 CF Refrigerator 3 Door White Tall,208114683,
,LG 25 Cu.Ft. Total Capacity 4 Door Refrigerator,208114686,
,LG LDF6920BB Fully Integrated Dishwasher,208117918,
,LG LDF6920ST Fully Integrated Dishwasher with 5 Wash Cycles 3 Spray Arms SenseClean System Delay Start Food Disposer and Self-Clean Filter: Stainless Steel,208117919,
,LG Dishwasher,208117920,
,LG Semi-Integrated Electronic Panel with Digital Status Display,208117922,
,LG Semi-Integrated Electronic Panel with Digital Status Display Dishwasher,208117924,
,LG 1.6 cu.ft. Over the Range Microwave,208117925,
,LG 1.6 cu.ft. Over the Range,208117926,
,LG 5.6 cu.ft. Freestanding Electric Range,208117929,
,LG 5.6 cu.ft. Freestanding Electric Range,208117930,
,LG 5.6 cu.ft. Freestanding Electric Range,208117931,
,LG 5.6 cu.ft. Freestanding Electric Range,208117932,
,LG 5.6 cu.ft. Freestanding Electric Range,208117933,
,LG 5.0 cu.ft. Freestanding Gas Range,208117936,
,LG 5.0 cu.ft. Freestanding Gas Range,208117937,
,LG 5.0 cu.ft. Freestanding Gas Range,208117938,
8.1 Megapixel - 16:9 - 2x Digital Zoom - 2.7' Active Matrix TFT Color LCD,Sony Cyber-shot DSC-W150 Digital Camera - Gold - DSCW150N,208154550,129.99
8.1 Megapixel - 16:9 - 2x Digital Zoom - 2.7' Active Matrix TFT Color LCD,Sony Cyber-shot DSC-W150 Digital Camera - Red - DSCW150R,208154551,139.94
10.1 Megapixel - 16:9 - 2x Digital Zoom - 2.7' Active Matrix TFT Color LCD,Sony Cyber-shot DSC-W170 Digital Camera - Red - DSCW170R,208154765,169
,SLING II LAPTOP CASE - 21 INCH - 4.5 INCH - 14.5 INCH - 2221,208154853,
,SLING I LAPTOP CASE - 18 INCH - 4.5 INCH - 13 INCH - 2211,208154854,59.95
,Denon DHT-FS3 2-piece Home Theater Audio System,208156275,
5.1-channel,Denon DHT-FS5 Surround Sound Speaker System,208156276,
,1.6 cu.ft. Over the Range Microwave,208156876,
,LG 2.0 cu.ft. Over the Range Microwave Oven,208156877,
,LG 2.0 cu.ft. Over the Range Microwave Oven,208156878,
,LG 2.0 cu.ft. Over the Range Microwave Oven,208156879,
for Mac,Logitech QuickCam Vision Pro Webcam - 960-000254,208167531,
