description,name,entityUrl,price
TomTom Windshield Mount and USB Car Charger,TOMTOM GPS Receiver Accessory Kit - 9N00.101,204071217,35.64
25 lb,Sanus Flat Panel Ceiling Mount - SC1A-B1,204080936,
Coby TF-DVD7006 7' Widescreen Portable DVD Player,Coby Electronics TF-DVD7006 Portable DVD Player - TFDVD7006,204154429,70.32
1 x Phone Line(s) - Headset Jack - Silver,Panasonic KX-TG1032S Dual Handset Digital Cordless Phone,204206934,61.14
1 x Phone Line(s) - Headset Jack - Silver,Panasonic KX-TG1033S Digital Cordless Phone with Three Handsets,204206935,
Panasonic DECT 6.0 Series 4 Handset Cordless Phone System with Answering System,Panasonic KX-TG1034S DECT 6.0 Cordless Phone - KX-TG1034S,204206936,89.45
,Panasonic KX-TGA101S DECT 6.0 Expansion Handset,204206937,36.04
,Garmin Suction Cup Mount - 010-10936-00,204219387,13.02
Photo Paper,Canon E-P100 Photo Pack For Selphy ES1 Printer - 1335B001,204222207,21.23
256MB Flash Memory - LCD - Portable,Olympus VN-4100PC 256MB Digital Voice Recorder - 141927,204222472,44.95
,OmniMount CMK-MINI Mini Wall Mounted Cable Management System,204222662,
130 lb - Black,Sanus LRF118-B1 Full Motion Wall TV Mount,204222897,
60 lb,Sanus MF209-B1 Full Motion Wall TV Mount,204222915,
Leather,Case Logic Universal Vertical PDA Leather Pouch - CLP104BB,204226641,9.99
60 lb,Sanus MF215-B1 Extending Full Motion Mount,204230770,
,BlueAnt Supertooth Light Compact Bluetooth Speakerphone -- Black - 093744,204238996,
Lithium Ion (Li-Ion) - 8.4V DC - Photo Battery,Sony InfoLithium H-Series NP-FH70 Camcorder Battery - NPFH70,204254634,57
DVD-R DVD+R DVD+RW DVD-RW CD-RW - DVD Video SVCD Video CD JPEG MP3 Playback - 1 Disc(s) - Progressive Scan - Silver,Sony DVPNS57P DVD Player - DVPNS57PS,204254738,45.32
,PLD4555RFC Professional SpeedClean 24-in. Under Counter Dishwasher (14 Place Settings Stainless Steel Energy Star),204264643,549
,Panasonic SR-NA18 10-Cup Rice Cooker/Warmer with Advanced Fuzzy Logic Technology,204272122,
,Frigidaire Electric Dryer - FEQ1442WH 5.8 Cubic Foot Super Capacity Drum,204274644,499
,Frigidaire Electric Dryer - FEQ332WH 5.7 Cu.Ft. Super Capacity Drum,204274645,420.29
,WED6400SB Cabrio Super Capacity Plus Electric Black Dryer,204274660,
,Genesis Series 3741001 60' Freestanding Gas Grill with 637 sq. in. Cooking Surface & 3 Stainless Steel Burners: Black LP Gas,204292470,636.61
,Weber Genesis Series 3770001 60' Freestanding Gas Grill,204292472,
,Weber Genesis Series S-310 60' Freestanding Gas Grill,204292473,
,Weber Summit Series S-450 74 1/10' Freestanding Gas Grill with 838 sq. in. Cooking Surface 6 Stainless Steel Burners Rotisserie Burner Stainless Steel Smoker Box & Stainless Steel Work Surface: LP Gas,204292477,
9' - LCD - ATSC NTSC - 16:9 - Stereo Sound - HDTV - DVD-R CD-R CD-RW,Audiovox VE927 9' TV/DVD Combo,204295637,279.99
Garmin 010-10908-00 Portable Friction Mount,Garmin Portable Friction Mount,204297424,
,Weber Genesis S-320 3780001 60' Freestanding Gas Grill,204318283,
,Weber Genesis Series E-310 3841001 60' Freestanding Gas Grill with 637 sq. in. Cooking Surface & 3 Stainless Steel Burners: Black Natural Gas,204318286,679.61
,Weber Genesis S-320 3880001 60' Freestanding Gas Grill with 637 sq. in. Cooking Surface 3 Stainless Steel Burners Flush-Mounted Side Burner & Stainless Steel Shroud: Natural Gas,204318288,754.29
Lithium Ion (Li-Ion) - 8.4V DC - Photo Battery,Sony NP-FH100 Lithium Ion Camcorder Battery - NPFH100,204327516,
,PANASONIC 2GB SD CARD PROHISPD 20 MB/SEC - RP-SDV02GU1A,204345240,11.99
,Case Logic 10' In-Car DVD Player Case - 11' x 9.25' x 4' - Nylon Koskin - Black (Black),204348269,18.98
,SONY STEREO BLUETOOTH HEADSET *NIC* - TMRBT10/TMRBT10A,204363358,41.99
,PANASONIC 4GB SDHC CARD CLASS 6 20 MB/SEC*NIC* - RP-SDV04GU1K,204389692,23.12
Transcend 8GB SDHC Secure Digital High Capacity Card,Transcend 8GB Secure Digital High Capacity (SDHC) Card - Class 6 - TS8GSDHC6,204407682,11.45
Clam Shell,Garmin Lightweight GPS Case - 010-10704-00,204416098,
Panasonic 5.8GHz 2 Line Expandable Phone With Extra Handset,Panasonic KX-TG6702B Cordless Telephone - KX-TG6702B,204419878,159.92
Lithium Ion (Li-Ion) - Photo Battery,Olympus PS-BLS1 Lithium Ion Digital Camera Battery - 260236,204443417,
- Black,Sony Noise Cancelling Earphone - MDRNC22/BLK,204448530,
Jabra BT5010 Bluetooth Headset,GN Jabra BT5010 Wireless Earset,204465488,26.37
512MB Flash Memory - LCD - Portable,Olympus DS-40 512MB Digital Voice Recorder - 141910,204505951,110.24
,Panasonic NN-SD377S 0.8 cu.ft. 800 WATT Microwave Oven,204519849,
22 x 10/100/1000Base-T LAN 2 x 10/100/1000Base-T LAN,Netgear ProSafe GS724TP 24 Port Smart Switch with PoE - GS724TP-100NAS,204549804,
,D-Link DWA-130 Wireless N USB Adapter,204556588,
,TOMTOM ONE XL Additional Mount Kit - 9S00.006,204558176,29.95
,Panasonic NNSD667S 1.2 cu. ft. Countertop Microwave Oven In Stainless Steel,204559208,
,Panasonic NNSD767S 1.6 cu. ft. Stainless Steel Countertop Microwave Oven,204559209,
,Panasonic NNSD797S 1.6 cu. ft. Genius Prestige Inverter Stainless Steel Microwave Oven,204559210,
,Panasonic 2.2 cu. ft. Stainless Steel Luxury Full Size Countertop Microwave Oven - NNSD967SS,204559211,
,Panasonic NNSN667B 1.2 cu. ft. Countertop Microwave Oven In Black,204559213,108.63
,Panasonic NNSN667W 1.2 cu. ft. Countertop Microwave Oven In White,204559214,107.81
VHS DVD-R CD-R - DVD Video MP3 Playback - Progressive Scan,Sony SLVD380P DVD/VCR Combo,204563763,
DVD+RW DVD-RW DVD+R DVD-R CD-RW - DVD Video SVCD Video CD JPEG MP3 Playback - 1 Disc(s) - Progressive Scan - Black,Sony DVPNS57P DVD Player - DVPNS57PB,204563770,39
,Pioneer CD-R55 Wireless Remote for Avic-D3/4900DVD - CDR55,204563949,14.05
,Whirlpool Duet Sport 27'' Electric Dryer - WED8300SWH 6.7 Cubic Foot Capacity,204569292,673.29
,Frigidaire 27'' Electric Stack Washer Dryer Combo - FEX831WH Extra-Large Capacity Wash Tub,204569335,895.39
,Nikon 18-200mm 3.5-5.6 G ED DX AFS VR Zoom Wide Angle Nikkor Lens - Niko_215930348,204587803,629
,Universal Remote Control MRF-350 Addressable Narrow Band RF Base Station with RFX-250 Antenna,204587909,174.72
Lithium Ion (Li-Ion) - 3.7V DC - Photo Battery,Nikon EN-EL10 No-Mem Lithium-Ion Camera Battery - 25752,204587960,21.26
,Nikon 55-200mm f/4-5.6G ED IF AF-S DX VR Zoom Telephoto Nikkor Lens - Niko_216687518,204587971,189.95
Combosaver Ultra Combination Notebook Lock,Kensington ComboSaver Ultra Notebook Lock - K64516US,204588748,
,Hoover Company #U5140900 Wide Path Bag Up Vac,204636071,
,Electrolux Homecare #EL012A Electro H12 Hepa Filter,204644752,
,iRobot Roomba Scooba Robot Floor Washer,204647332,
TTL E-TTL,Canon Speedlite 580EX II Flash Light - 1946B002,204679142,
,Altec Lansing inMotion iM600 Portable Audio Speaker System - IM600,204679144,
Monochrome Copier - 1.33 cpm Mono - Inkjet,Canon FAX-JX200 Fax Machine - 1735B002AA,204734549,
,Logitech V220 Cordless Optical Mouse for Notebooks - 910-000153,204740188,
2.0-channel - Silver,Yamaha NX-U10 USB Powered Stereo Speaker - NX-U10SL,204740191,
LaCie Ethernet Big Disk 2TB USB 2.0 16MB 7200RPM Network Attached Storage,LaCie Big Disk Ethernet Network Storage Server - 301239U,204740975,
1 x Proprietary - 1 x Mini-phone Stereo 1 x Type A,Kenwood iPod Direct Cable - kcaip200,204791586,19.72
Proprietary Male to Type A Male USB 2 x Mini-phone Male - 4.92ft,Kenwood iPod-Video Direct Adapter - KCAiP300V,204791643,26
,LG Electronics LSC21943ST 21.0 cu. ft. Counter-Depth Side-by-Side Refrigerator with 3 Spill-Protector Glass Shelves SpacePlus Ice System Digital LED Display and CustomCube Automatic Ice Maker,204792876,
,LG Electronics DLE2516W 27' Electric Dryer,204792884,
,LG Electronics DLG2526W 27' Gas Dryer with 7.0 cu. ft. Capacity 5 Dry Programs 5 Temperature Controls 5 Drying Levels and Sensor Dry System,204792885,
,LG Electronics WM2016CW 27' Front-Load Washer with 3.5 cu. ft. Capacity 5 Wash Programs 5 Temperature Levels 1050 RPM Maximum and SenseClean System,204792886,699
,Computer Speakers - SRSA212/BLK,204793090,22.53
- Stereo,Sony MDR-Q68LW Stereo Earphone - MDRQ68LW,204793355,19.05
,Sony SRS-BTM30 Wireless Stereo Bluetooth Speaker - SRSBTM30,204793356,
Logitech Digital Precision PC Headset,Logitech Digital Precision PC Gaming Headset - 981-000040,204822679,31.99
Logitech QuickCam Pro 9000,Logitech QuickCam Pro 9000 Webcam - 960-000048,204823067,
,Sirius SCC1 Universal Vehicle Tuner,204832843,64.72
Audiovox Xpress EZ XM Radio Receiver with Vehicle Kit,Audiovox XMCK5P EXPRESSEZ Satellite Radio - XMCK5P,204849801,
,Audiovox Xpress R XM Radio Receiver with Vehicle Kit XMCK20P,204860316,76.42
Connectivity: Wireless - Stereo - Behind-the-neck,Monster Cable iFreePlay Cordless Headphone - AI SH HPHONE,204884519,
LaCie Big Disk Extreme 1TB Hard Drive - Triple Interface (USB 2.0 & FireWire 400/800) External Hard Drive,LaCie Big Disk Extreme+ Hard Drive - 301199U,204937142,
TERK XMRVRFM002 CommanderMT Universal In-Car XM Receiver,Audiovox Satellite Radio Tuner,204939361,
,Logitech Cordless Desktop Wave - 920-000264,205074757,
1 x Phone Line(s),Uniden DECT 6.0 1.9GHz Cordless Phone - DECT2080-2,205083947,46.72
,UNIDEN DCX200 DECT 6.0 Accessory Handset & Charger,205083968,
,Sharp 1100 Watt Over the Counter Microwave,205106045,
Navigator Starter Kit,Garmin Suction cup mount/12-volt adapter kit - 010-10979-00,205106048,
,Sony PSP Core System (Piano Black) (Slim Model with AV Video Out Port) - 98510,205121310,
,Unreal Tournament III - 26991,205131849,
,TiVo HD Digital Video Recorder - Up to 20 Hours in HD! - TCD652160,205144562,259.99
Leather - Black,Nikon Digital Camera Leather Case - 5811,205145879,7.99
Logitech V470 Bluetooth Notebook Mouse - Blue,Logitech V470 Cordless Laser Mouse for Notebooks - 910-000298,205466519,
DVD+RW DVD-RW DVD+R Memory Stick Memory Stick Duo Secure Digital (SD) Card xD-Picture Card CompactFlash (CF) - DVD Video MP3 - 1 Disc - 12Hour Recording,Sony VRDMC5 Digital Video Recorder,205467942,166.29
Laser - USB,Logitech MX Air Rechargeable Cordless Air Mouse - 931633-0403,205505156,
1 x Mini-phone Stereo - 1 x Mini-phone Stereo - 3ft,Monster Cable iCable A IC MINI IP-3 S Audio Stereo Cable - 123870,205516750,
Bracketron IPM-202-BL Pro Series iPod Docking Kit,Bracketron iPod Docking Kit,205520997,4.65
Bracketron Nav-Mat - Portable GPS Dash Mount,Bracketron Nav-Mat Portable GPS Dash Mount - UFM-100-BL,205521002,
,233XSGG - Skagen,205554287,70
,Seiko SXDA04,205554724,138
Canon PIXMA MX310 Office All-in-One Printer Scanner Copier and Fax with High-Speed Auto Document Feeder,Canon PIXMA MX310 Multifunction Photo Printer - 2184B002,205557530,89.99
Canon Pixma MX700 Office All-in-One Printer,Canon PIXMA MX700 Multifunction Photo Printer - 2186B002,205557539,
Canon CanoScan 8800F,Canon CanonScan 8800F Flatbed Scanner - 2168B002,205557540,235.5
Peerless SA745PU - Articulating Wall Arm for 32' to 45' LCD and Plasma Screens - Piano Black,Peerless SmartMount 700 Series Articulating Wall Arm,205561996,
Peerless SA750PU - Articulating Wall Arm for 32' to 50' LCD and Plasma Screens - Piano Black,Peerless SmartMount 700 Series Articulating Wall Arm,205562000,
Top Loading - Leather - Red,Sony LCS-TWA/R Cyber-shot Camera Case,205592435,27.92
Top Loading - Leather - Black,Sony LCS-TWA/B Cyber-shot Camera Case - LCSTWA/B,205592439,34
Dolby Pro Logic IIx Dolby Digital Surround DTS-ES DTS Neo:6 DTS 96/24 Neural SurroundFM AM XM,Denon AVR-3808CI A/V Receiver - AVR3808CI,205593354,1698.00
Dolby Pro Logic IIx Dolby Digital Surround DTS-ES DTS Neo:6 DTS 96/24 Neural SurroundFM AM XM,Denon AVR-4308CI A/V Receiver - AVR4308CI,205593367,1849.77
Canon EOS 40D 10 Megapixel Digital SLR Camera - Body Only,Canon EOS 40D Digital SLR Camera - 1901B004,205599984,849.95
Canon EOS 40D Digital SLR Camera with 28-135mm Lens,Canon EOS 40D Digital SLR Camera with EF 28-135mm f/3.5-5.6 IS USM Lens - 1901B017,205599985,1029.88
,GE 24775 Amplified Quantum HDTV Antenna,205664913,
Leather - Burgundy,Canon PSC-1000 Semi-Hard Leather Case - 2350B001,205664938,16.97
,LG 7.3 cu.ft. Front Control ST DrumChrome Door Trim (Pearl Gray),205664963,
,LG Electric Dryer with 9 Drying Programs,205664964,
,LG XL Capacity Electric Dryer,205664966,
,LG 3.8 Cu. Ft. 7-Cycle Extra-Large Capacity Washer - White,205664972,
,LG 4.0 cu. ft. Capacity Front Load Washer w/ Sanitary cycle,205664973,
,Nintendo DS Lite (Crimson & Black) - USGSRMKB,205690063,
LaCie Little Disk 250GB USB 2.0 5400RPM Portable External Hard Drive,LaCie Little Disk Hard Drive - 301278,205728900,79.99
1GB Flash Memory - Silver,Apple iPod Shuffle 1GB MP3 Player - MB226LL/A,205729817,
Rubber - Black,Speck Products ToughSkin for iPod classic - IC-BLK-TS,205753566,12.95
TV Cable Box - Universal Remote,Sony Universal Remote Control - RM-EZ4,205761272,12.72
Black,Klipsch RoomGroove Wireless iPod Speaker System - 1006602,205761530,199.99
2 GB,Sony 2GB Memory Stick Micro (M2) - MSA2GD,205769439,
,Universal Remote Control MRF-260 Barrier-Free Addressable RF Base Station,205777541,86.25
,Transcend 2GB CompactFlash Card (133x) - TS2GCF133,205777549,
1 x Mini Type C HDMI - 1 x Type A HDMI - 10ft,Sony HDMI Mini Cable - VMC30MHD,205809367,36.95
PC Card,Linksys Ultra RangePlus Dual Band Wireless-N PC Card - WPC600N,205817166,44.08
Groove PM20 Computer Speakers,Klipsch Groove PM20 Computer Speakers - 1007596,205817784,
1 x HDMI - 1 x mini-HDMI - 4.92ft,Sony High Definition HDMI to Mini-HDMI Cable - VMC15MHD,205835447,26.95
,Canon PSC-85 Deluxe Soft Case for the Powershot-A650 IS and A720 IS - 2595B002(AA),205838157,8.77
Lithium Ion (Li-Ion) - 4.2V DC - Photo Battery,Sony InfoLITHIUM D-Type NP-FD1 Digital Camera Battery - NPFD1,205844265,41.72
Leather - White,Sony LCJ-THC/B Jacket Case with Stylus - LCJ-THC/W,205844279,35.08
Top Loading - Polyamide - Black,Sony LCS-CSJ Soft Camera Case - LCSCSJ,205844282,
Top Loading - Polyamide - Black,Sony LCS-CSQ Soft Cyber-shot Camera Case - LCSCSQ/B,205844283,
Glass - Black,Peerless SS550P Flat Panel TV Stand,205852250,
Ethernet Wi-Fi,Sony LFV30 Network Media Player,205852387,172.47
Transcend 4GB CompactFlash Memory Card (133x),Transcend 4GB CompactFlash Card (133x) - TS4GCF133,205865183,
Transcend 8GB CompactFlash Card (133x),Transcend 8GB Compact Flash Card (133x) - TS8GCF133,205865187,
,PlayStation 3 Charging Dock for PS3 Wireless Controllers by Nyko - 83053,205886768,21.05
Office Mac Home & Student 2008,Microsoft Office:mac 2008 Home and Student Edition - GZA-00006,205888207,
,LG 27' Front-Load Electric Dryer with 7.3 cu. ft. Capacity,205985716,
,LGs New Electric SteamDryer,205985717,
,The LG Electric SteamDryer,205985718,
,The LG Electric SteamDryer,205985719,
,Garmin Suction Cup Mount - 010-10815-00,205986339,17.4
Plastic Rubber - Clear,Contour Showcase Classic for iPod classic 80 GB - SH-CLS80-B02,206120294,
Top Loading - Leather - Black,Sony LCS-CSL Cyber-shot Camera Case,206160056,
Black,Panasonic KX-TGA820B Cordless Handset,206179521,39.76
1 x Phone Line(s) - Black,Panasonic KX-TG8232B Cordless Phone,206179525,79.99
1280 x 720 WXGA - 10.8lb,Panasonic PT-AX200U Home Theater Projector,206179562,999
,Linksys Media Center Extender - DMA2100,206181767,
SIRIUS SP5TK1 Sportster 5 Dock & Play Radio with Car Kit,Sirius Sportster 5 Radio with Vehicle Kit,206356229,131.99
,SIRIUS SLV2 SIRIUS Stiletto 2 Portable Radio Vehicle Kit,206356230,
,SIRIUS SL2PK1 SIRIUS Stiletto 2 Portable Radio,206356232,234.99
,SIRIUS SLH2 SIRIUS? Stiletto 2 Portable Radio Home Kit,206356233,
,SIRIUS SRH1000 Polk Audio Designs? Dual Zone Home Tuner,206356234,
30ft,Griffin iTrip FM Transmitter - 4052-TRPSEB,206359209,
Canon PSC-1000 Deluxe Grey Leather Case,Canon PSC-1000 Semi-Hard Leather Case - 2349B001,206362623,19.99
,Polkaudio CSi A4 Black High Performance Center Channel Loudspeaker - AM4415-A,206362747,189.47
,Polkaudio CSi A4 Cherry High Performance Center Channel Loudspeaker - AM4412-A,206362748,
,Polkaudio CSi A6 Black High Performance Center Channel Loudspeaker - AM6615-A,206362749,449.95
Intel Core 2 Duo T5600 1.83GHz - 1GB DDR2 SDRAM - 80GB - Combo Drive (CD-RW/DVD-ROM) - Bluetooth Gigabit Ethernet Wi-Fi - Mac OS X 10.5 Leopard - Small Desktop,Apple Mac mini Desktop - MB138LL/A,206362873,574.99
12.3 Megapixel - 3' Active Matrix TFT Color LCD,Nikon D300 Digital SLR Camera - 25432,206419131,1521.09
,Yamaha YSP-4000 Digital Sound Projector -- Black - YSP-4000BL,206460113,
Yamaha New shaped subwoofers with Advanced YST II and Down-Firing Active design (130W),Yamaha YST-FSW150 Subwoofer - YST-FSW150BL,206460118,
Yamaha YST-FSW100 6.5' 130-Watt Powered Sub-woofer- Black,Yamaha YSTFSW100 Subwoofer - YST-FSW100BL,206460121,
Wall Mount Bracket for the Yamaha Digital Sound Projectors models YSP-4000 YSP-3000 YSP-900 and YSP-800,Yamaha SPM-K30 Mounting Installation Bracket - SPM-K30,206460124,
Linksys Ultra RangePlus Wireless-N Broadband Router,Linksys RangePlus WRT160N 4-Port Wireless-N Broadband Router - WRT160N,206462228,
,Logitech Harmony RF Extender - 915-000044,206481908,
,SIRIUS SCVDOC1 SiriusConnect? Universal Vehicle Kit,206526266,
,Motorola MOTOROKR T505 Bluetooth In-Car Speakerphone - 89149,206575951,
CMOS - Wireless Wi-Fi Wireless Wi-Fi Cable Cable,Linksys Wireless-G Internet Video Camera - WVC54GCA,206576716,
54Mbps,Linksys WGA600N Wireless Gaming Adapter,206576717,
LaCie 1TB USB 2.0 7200RPM Desktop External Hard Drive - Design by Neil Poulton,LaCie USB 2.0 External Hard Drive - 301304U,206615080,
LaCie 500GB USB 2.0 7200RPM Desktop External Hard Drive - Design by Neil Poulton,LaCie USB 2.0 External Hard Drive - 301302U,206615085,86.95
,DELONGHI DCF212T 12-Cup Drip Coffee Maker,206639246,49.99
Linksys Dual-Band Wireless-N USB Network Adapter,Linksys WUSB600N Dual-Band Wireless-NUSB Network Adapter - WUSB600N,206671732,
,MONSTER A IP FM-CH 250 iCarPlay Wireless 250 FM Transmitter for iPod & iPhone - AIPFM-CH250,206678505,
,Escort X50 Passport 8500 Radar Detector - High Intensity Red Display - 8500X50RED,206722262,252
,Escort new radar gps powered - 9500I,206722263,409.99
,Cuisinart PSC-400 Cuisinart Programmable Slow Cooker - PSC400,206725196,79.95
,Cuisinart TOB-195 Cuisinart Exact Heat Convection Toaster Oven Broiler - TOB195,206725198,178.99
,DeLonghi ESAM3300 Esclusivo Magnifica Super-Automatic Espresso/Coffee Machine,206725724,916.55
,Sony ADMSCF1 Sony Memory Stick Duo Adapter for CF,206725964,
Black,Sony VCL-DH1774 Telephoto Lens - VCLDH1774,206725966,
,20' Television CRT - HTR20,206728281,
,Full Size Steam Washer and Dryer Combination with Allergiene Cycle,206745972,
,Nintendo DS Lite (Cobalt Blue and Black) - USGSBMKB,206746475,
3 x FM,Griffin iTrip AutoPilot FM Transmitter - 4046-TRPAUTOC,206761808,
Logitech Harmony One Advanced Universal Remote,Logitech Harmony One Advanced Universal Remote Control - 915-000035,206780877,179.99
LaCie 320GB Little Disk USB 2.0 5400RPM Portable External Hard Drive,LaCie Little Disk Hard Drive - 301829,206783256,
500GB - 7200rpm - Serial ATA/300 IEEE 1394b IEEE 1394a USB 2.0 - External SATA FireWire FireWire USB - External,LaCie d2 Quadra Hard Drive - 301825U,206783262,138.88
,Canon VIXIA HV30 High Definition Digital Camcorder - 2680B001,206808430,650.99
Canon VIXIA HF100 High Definition Camcorder,Canon VIXIA HF100 High Definition Digital Camcorder - 2708B001,206808431,529
Canon DC320 DVD Digital Camcorder,Canon DC320 Digital Camcorder - 2691B001,206808432,299.99
Canon VIXIA HF10 High Definition Camcorder,Canon VIXIA HF10 High Definition Digital Camcorder - 2573B001,206808434,638.09
Canon FS10 Dual Flash Memory Camcorder,Canon FS10 Digital Camcorder - 2686B001,206808440,341.72
Canon FS11 Flash Memory Camcorder,Canon FS11 Digital Camcorder - 2685B001,206808441,405.97
Canon FS100 Flash Memory Camcorder,Canon FS100 Digital Camera - 2699B001,206808445,299.95
Sharp AQUOS LC-37D44U - 37' Widescreen LCD HDTV - 7500:1 Dynamic Contrast Ratio - 6ms Response Time,Sharp AQUOS LC37D44U 37' LCD TV - LC37D44U,206812380,
DVD+RW DVD-RW DVD-R CD-RW - DVD Video Video CD SVCD MP3 JPEG Playback - Progressive Scan,Toshiba SD-4100 DVD Player,206812505,39.36
,Uniden DCX300 DECT 6.0 Accessory Handset and Cradle for the DECT2000 series,206827757,
1 x Phone Line(s) - Black,Panasonic KX-TG4323B 5.8 GHz Expandable Digital Cordless Phone,206854515,
1 x Phone Line(s) - Black,Panasonic KX-TG4324B 5.8 GHz Expandable Digital Cordless Phone,206854516,78.33
Silver Pearl - Wall-mountable,Panasonic KX-TGA630S Cordless Handset,206854534,28.34
,Transcend 16GB JetFlash USB Flash Drive - TS16GJFV10,206870284,30.95
,Transcend 16GB SDHC Card & Compact Card Reader S5 - TS16GSDHC6-S5W,206870289,
Glass - Black,Samsung TR72B TV Stand,206887553,232.14
,Weber Q 320 Gas Grill,206887905,
,Weber Genesis E/S series Rotisserie,206887992,
,Weber Cast Iron Griddle for Genesis Silver As and Spirit 500s & Spirit 200 Series,206888001,
,Weber Cast Iron Griddle for Genesis BC 1000 - 5500 & Spirit E & S 300 Series,206888011,
,Weber Premium Cover for Genesis Sivler A Grills & Spirit E-200 Series,206888012,29.99
Logitech Cordless Desktop MX 5500 Revolution,Logitech Cordless Desktop MX 5500 Revolution Keyboard and Mouse - 920-000383,206892248,
Aqua,Speck Products SeeThru Case for Apple iMac LCD - IM20-AQU-SEE,206892902,
Panasonic SDR-H40 40GB Hard Disk Drive/SD Hybrid Camcorder with 42x Optical Zoom Optical Image Stabilization One-Touch DVD Copy and Anti-Shock Shield,Panasonic Palmcorder SDR-H40 Digital Camcorder,206895864,328.88
Elgato EyeTV 250 Plus Video Converter and TV Tuner for Analog and HDTV Reception,Elgato EyeTV 250 Plus TV Tuner - 10020780,206898357,
Elgato EyeTV Hybrid TV Tuner Stick for Analog and HDTV Reception - USB,Elgato EyeTV Hybrid Analog/Digital TV Tuner Stick - 10020630,206898358,
,15in Lcd/dvd Tv Combo - HLC15R,206901613,
,13in Crt Tv W/atsc Tuner - HTR13,206901618,105.62
,13in Crt Tv/dvd Combo - TCR13,206901619,
,Griffin RoadTrip with SmartScan FM Transmitter - 4040-RDTRPB,206901652,
10 Megapixel - 16:9 - 4x Digital Zoom - 2.5' Active Matrix TFT Color LCD,Nikon Coolpix S550 Digital Camera - Plum - 26110,206917814,
10 Megapixel - 16:9 - 4x Digital Zoom - 2.5' Active Matrix TFT Color LCD,Nikon Coolpix S550 Digital Camera - Graphite Black - 26108,206917815,168.72
Nikon COOLPIX S210 8 Megapixel Digital Camera with 3x Optical Zoom-NIKKOR ISO2000 2.5' LCD & VR Image Stabilization - Plum,Nikon Coolpix S210 Digital Camera - Plum - 26103,206917816,118.72
10 Megapixel - 16:9 - 4x Digital Zoom - 2.5' Active Matrix TFT Color LCD,Nikon Coolpix S550 Digital Camera - Cool Blue - 26109,206917817,169.95
,Garmin Adjustable Vehicle Suction Cup - 010-10823-03,206928359,7.22
,Canon PIXMA iP2600 Inkjet Photo Printer - 2435B002,206928378,
Canon PowerShot A590 IS 8 Megapixels 4x Optical Zoom 2.5' LCD ISO 1600 Digital Camera,Canon PowerShot A590 IS Digital Camera - 2462B001,206928380,
Canon PowerShot SD1100 IS 8 Megapixels ISO 1600 3x Optical Zoom Digital Camera - Swing Silver,Canon PowerShot SD1100 IS Digital ELPH Camera - Swing Silver - 2508B001,206928384,
Canon PowerShot SD1100 IS 8 Megapixels ISO 1600 3x Optical Zoom Digital Camera - Pink Melody,Canon PowerShot SD1100 IS Digital ELPH Camera - Melody Pink - 2509B001,206928388,
Canon PowerShot SD1100 IS 8 Megapixels ISO 1600 3x Optical Zoom Digital Camera - Rhythm & Blue,Canon PowerShot SD1100 IS Digital ELPH Camera - Rhythm & Blue - 2512B001,206928390,
,Belkin Neoprene Sleeve for MacBook Air - Neoprene - Black,206928452,
Toshiba D-R410 - DVD Recorder w/ 1080p Upconversion,Toshiba D-R410 DVD Player/Recorder,206928604,
Toshiba D-VR610 - DVD Recorder/VCR Combo,Toshiba D-VR610 DVD VCR Combo,206928605,
Toshiba D-R560 - DVD Recorder w/ Built in Digital Tuner,Toshiba D-R560 DVD Player/Recorder,206928606,
Toshiba D-VR660 DVD Recorder/VCR Combo w/ Built-In Digital Tuner,Toshiba D-VR660 DVD/VCR Combo,206928607,
Toshiba SD-6100 - DVD Player w/ 1080p Upconversion,Toshiba SD-6100 DVD Player,206928608,
Canon PIXMA MX850 Office All-In-One Printer,Canon PIXMA MX850 Multifunction Photo Printer - 2436B002,206928744,
,Sony Mylo COM-2 Personal Communicator - Black - COM2BLACK,207338879,
32' - Active Matrix TFT - ATSC NTSC - 135 Channels - 1920 x 1080 - HDTV,Sharp AQUOS LC-32D64U 32' LCD TV,207338890,
16:9 - 3.2' Color LCD,Sony Handycam HDR-SR11 High Definition Digital Camcorder - HDRSR11,207338961,666.41
PLANTRONICS 920 .AUDIO DIGITAL USB PC HEADSET,Plantronics .Audio 920 Wireless Earset - 78592-01,207383660,
50' - ATSC NTSC - 16:9 - 1366 x 768 - Surround - HDTV,Panasonic Viera TH-50PX80U 50' Plasma TV,207388752,
42' - ATSC NTSC - 16:9 - 1920 x 1080 - Surround - HDTV,Panasonic Viera TH-42PZ85U 42' Plasma TV,207388754,
50' - ATSC NTSC - 16:9 - 1920 x 1080 - HDTV,Panasonic VIERA TH-50PZ85U 50' Plasma TV,207388755,1499.00
46' - ATSC NTSC - 16:9 - 1920 x 1080 - Surround - HDTV,Panasonic Viera TH-46PZ85U 46' Plasma TV,207388756,1149.99
,Panasonic TH-42PZ80U - 42' Widescreen 1080p Plasma HDTV - 1000000:1 Dynamic Contrast Ratio,207388757,845.48
50' - ATSC NTSC - 16:9 - 1920 x 1080 - Surround - HDTV,Panasonic Viera TH-50PZ80U 50' Plasma TV,207388758,1364.96
46' - ATSC NTSC - 16:9 - 1920 x 1080 - Surround - HDTV,Panasonic Viera TH-46PZ80U 46' Plasma TV,207388759,1249.94
42' - ATSC NTSC - 16:9 - 1024 x 768 - Surround - HDTV,Panasonic Viera TH-42PX80U 42' Plasma TV,207388760,749
S-VHS VHS DVD+RW DVD-RW DVD+R DVD-R DVD-RAM CD-RW - DVD Video Video CD SVCD CD-DA JPEG MP3 SQPB Playback - 1 Disc(s) - Progressive Scan - 14.46Hour Recording,Sony RDRVXD655 DVD/VCR Combo,207390171,261.96
Woofer - Cable,polkaudio PSW Series PSW110 Powered Subwoofer,207390180,249.95
Lithium Ion (Li-Ion) - 7.2V DC - Photo Battery,Panasonic Lithium Ion Camcorder Battery - VW-VBG130,207390184,56.69
DVD Player 5.1 Speakers - Progressive Scan - White,Bose Lifestyle 48 Home Theater System - 43479,207390309,3999.00
,Polk Audio RM705 Black 5.1 Channel Home Theater System - RM 705,207390452,398.72
200 lb - Anthracite,OmniMount Ultra Low Profile ULPT-L Flat Panel Wall Mount - ULPT-L A,207390496,278.95
